,Id,roberta_neg,roberta_neu,roberta_pos,roberta_polarity,Source,Date,Title,Content,Name,Rating,Version,emotion,,,
440,441,0.026407976,0.289883137,0.683708906,1,Fast Food Rampage,2017-01-23,,Dear FF Rampage please update this game becouse same thing please update this game more thing more more please UPDATE THIS GAME PLEASE UPDATE THE FAST FOOD RAMPAGE!!!.😊😁,A Google user,5,1.0.6,neutral,,,
441,442,0.001849886,0.013126812,0.98502326,1,Fast Food Rampage,2017-01-22,,Awesome really well done for me,A Google user,5,1.0.6,admiration,,,
442,443,0.003905211,0.037976231,0.958118558,1,Fast Food Rampage,2017-01-22,,It is fun and fast passed game,A Google user,5,1.0.6,joy,,,
443,444,0.001613579,0.010491985,0.987894475,1,Fast Food Rampage,2017-01-22,,It is really  cool and I liked it,A Google user,5,1.0.6,love,,,
444,445,0.793853343,0.182015285,0.024131406,0,Fast Food Rampage,2017-01-22,,Too glitchy,A Google user,3,1.0.6,excitement,,,
445,446,0.851235628,0.118920214,0.0298442,0,Fast Food Rampage,2017-01-22,,"It's just boring. Cool looking, but not much to do",A Google user,2,,annoyance,,,
446,447,0.066038191,0.354452819,0.57950896,1,Fast Food Rampage,2017-01-22,,Nice,A Google user,5,1.0.6,admiration,,,
447,448,0.047630731,0.340470523,0.61189872,1,Fast Food Rampage,2017-01-21,,Yay,A Google user,5,1.0.6,excitement,,,
448,449,0.002938097,0.02002695,0.977034926,1,Fast Food Rampage,2017-01-21,,"Fun with almost unnoticeable micro-transactions, all in all a great game.",A Google user,5,1.0.6,admiration,,,
449,450,0.001676889,0.010242301,0.98808074,1,Fast Food Rampage,2017-01-20,,It is a super good game,A Google user,5,1.0.6,excitement,,,
450,451,0.009261786,0.102064952,0.888673246,1,Fast Food Rampage,2017-01-19,,"Played this game while being forced to eat a free range gluten-free vegan meal, the controls are iffy but it made the experience way better",A Google user,5,1.0.6,joy,,,
451,452,0.001490863,0.006942195,0.991566956,1,Fast Food Rampage,2017-01-19,,AMAZING! In my opinion it's the best game on the store right now,A Google user,5,1.0.6,admiration,,,
452,453,0.290025979,0.646582127,0.063391916,0,Fast Food Rampage,2017-01-19,,why not...,A Google user,3,,neutral,,,
453,454,0.82099992,0.158910081,0.02008998,0,Fast Food Rampage,2017-01-18,,It's all good it just won't work it won't start with my phone it's complete bullshi.....Mm mabye I shouldn't be saying that.,A Google user,1,,annoyance,,,
454,455,0.921943188,0.072330199,0.005726637,0,Fast Food Rampage,2017-01-18,,Bad does not work on android,A Google user,1,1.0.6,neutral,,,
455,456,0.063778661,0.244156674,0.692064643,1,Fast Food Rampage,2017-01-18,,good game.bit repetitive after a while,A Google user,4,1.0.6,admiration,,,
456,457,0.182874084,0.640233636,0.17689234,0,Fast Food Rampage,2017-01-16,Love it,So much,A Google user,4,1.0.6,neutral,,,
457,458,0.188412666,0.700376868,0.111210428,0,Fast Food Rampage,2017-01-15,Love it,Its a gucci game,A Google user,5,1.0.6,neutral,,,
458,459,0.046155155,0.168836161,0.785008669,1,Fast Food Rampage,2017-01-14,Great time passer,Fun as hell,A Google user,5,1.0.6,amusement,,,
459,460,0.193690136,0.527507722,0.278802127,1,Fast Food Rampage,2017-01-14,,Recommend it,A Google user,5,1.0.6,neutral,,,
460,461,0.046418559,0.665844798,0.287736595,1,Fast Food Rampage,2017-01-12,Fun,Thanx,A Google user,5,1.0.6,gratitude,,,
461,462,0.01231072,0.042517982,0.945171297,1,Fast Food Rampage,2017-01-12,,"Great, aside from certain technical issues you will have a lot of fun",A Google user,5,1.0.6,admiration,,,
462,463,0.005316436,0.075243853,0.919439793,1,Fast Food Rampage,2017-01-12,What I dreamed,I always wanted that small video from YouTube to be real thank you for making this now can you make the trump one ;),A Google user,5,1.0.6,desire,,,
463,464,0.065606564,0.837045014,0.097348467,1,Fast Food Rampage,2017-01-12,ｆｕｎ　ｂｕｔ,ｎｅｅｄ　ｔｏ　ｉｍｐｒｏｖｅ　ｃｏｎｔｒｏｌｌｓ,A Google user,4,1.0.6,curiosity,,,
464,465,0.007687518,0.073010564,0.919301927,1,Fast Food Rampage,2017-01-11,Cool game,I reply love fframpage,A Google user,5,1.0.6,love,,,
465,466,0.793987632,0.181746662,0.024265651,0,Fast Food Rampage,2017-01-11,,I would give it 5 stars but it keeps crashing after a ad pops up or I pause and unpause and  when I load a new map.,A Google user,2,1.0.6,approval,,,
466,467,0.002147819,0.008054248,0.98979795,1,Fast Food Rampage,2017-01-10,Amazing,I loved the music!!! Bangers all day. And once I unlocked the mini fries gun the experience was well worth the grind. A really good game. There's a learning curve to the controls,A Google user,5,1.0.6,joy,,,
467,468,0.665292323,0.267193735,0.067513965,0,Fast Food Rampage,2017-01-10,Retro,It's the perfect game for killing vegans,A Google user,5,1.0.6,approval,,,
468,469,0.014571379,0.064902581,0.920526028,1,Fast Food Rampage,2017-01-10,,Love it,A Google user,5,1.0.6,love,,,
469,470,0.049257439,0.039675288,0.911067247,1,Fast Food Rampage,2017-01-09,,I F****** love this game,A Google user,5,1.0.6,love,,,
470,471,0.050564732,0.913914502,0.035520736,0,Fast Food Rampage,2017-01-09,,Anyone else came here from gameranx?,A Google user,5,,curiosity,,,
471,472,0.301683336,0.436732054,0.26158464,0,Fast Food Rampage,2017-01-09,Fun game,"Good game, but not much content.",A Google user,4,1.0.6,admiration,,,
472,473,0.001462693,0.008122961,0.990414321,1,Fast Food Rampage,2017-01-08,,Great game. Very fun. One of the best twin stick shooters I have played on Android.,A Google user,5,1.0.6,admiration,,,
473,474,0.004361586,0.022577558,0.973060906,1,Fast Food Rampage,2017-01-08,La pinia,Best game ever,A Google user,5,,admiration,,,
474,475,0.050075088,0.131729841,0.818195045,1,Fast Food Rampage,2017-01-08,Hilarious!!,This just hilarious and great game. And yes the control is a bit hard. Fix that and it would be perFect,A Google user,5,1.0.6,amusement,,,
475,476,0.357530713,0.562951803,0.079517461,0,Fast Food Rampage,2017-01-08,,Haven't seen or played anything like it.,A Google user,5,1.0.6,surprise,,,
476,477,0.003196939,0.020254869,0.976548254,1,Fast Food Rampage,2017-01-08,Settings,"Great game, great everything, but make little adjustments to the controls, maybe customizable? That'd  be cool ;)",A Google user,4,1.0.6,admiration,,,
477,478,0.011374758,0.09803731,0.890587926,1,Fast Food Rampage,2017-01-08,,Is fun and easy,A Google user,5,1.0.6,amusement,,,
478,479,0.193632722,0.560698986,0.245668262,1,Fast Food Rampage,2017-01-08,It's fun,Ayy,A Google user,5,1.0.6,neutral,,,
479,480,0.006034708,0.046265051,0.947700322,1,Fast Food Rampage,2017-01-08,Awesome,Just awesome,A Google user,5,1.0.6,admiration,,,
480,481,0.005036826,0.034872331,0.960090816,1,Fast Food Rampage,2017-01-08,Love the game,The only thing is that i wish there were multiplayer online. That would be amazingly fun! Keep updating please.,A Google user,5,1.0.6,joy,,,
481,482,0.079933636,0.804809153,0.115257196,1,Fast Food Rampage,2017-01-08,Awesome,Reminds me of the first GTA,A Google user,5,,neutral,,,
482,483,0.160194144,0.309266239,0.530539632,1,Fast Food Rampage,2017-01-08,Proper exit,I love the game but Please make a proper way to exit the game.,A Google user,4,1.0.6,love,,,
483,484,0.002689517,0.015617693,0.981692791,1,Fast Food Rampage,2017-01-08,,Game is great,A Google user,5,1.0.6,admiration,,,
484,485,0.002596602,0.010040343,0.98736304,1,Fast Food Rampage,2017-01-08,,THIS GAME IS AWESOME! !!,A Google user,5,1.0.6,admiration,,,
485,486,0.566141784,0.267657071,0.166201159,0,Fast Food Rampage,2017-01-07,Keeps crashing,"This is a cute little game and a great concept but the controls aren't great and after 30 seconds of playing it crashes every time. Again, good concept but you need to improve on bug awareness and controls",A Google user,2,,admiration,,,
486,487,0.01749878,0.084419936,0.898081243,1,Fast Food Rampage,2017-01-07,So fun,It's funny and addictive. Great time killer. Recommended for those who like to lay off from serious games.,A Google user,5,1.0.6,admiration,,,
487,488,0.628499866,0.320630163,0.050869934,0,Fast Food Rampage,2017-01-07,Crash fix needed,Cant get past loading screen would give higher stars when fix :(,A Google user,1,1.0.6,approval,,,
488,489,0.919902027,0.073030882,0.007067091,0,Fast Food Rampage,2017-01-07,Fast food rampange,The game crashed,A Google user,4,1.0.6,neutral,,,
489,490,0.219446495,0.333449066,0.447104365,1,Fast Food Rampage,2017-01-07,Great Game,"Unfortunately the edge on my Samsung edge makes control a little inconsistent but it is a great game, silly twinstick shooting.",A Google user,5,1.0.6,admiration,,,
490,491,0.013711784,0.226483241,0.759804964,1,Fast Food Rampage,2017-01-07,Good,Fun,A Google user,5,1.0.6,amusement,,,
491,492,0.905258894,0.079678267,0.015062797,0,Fast Food Rampage,2017-01-07,Controls??,"The controls are terrible, you can't shoot straight up or down and can move slower so you're forever moving in circles, then the shooting of burgers is so slow that you keep double tapping too fast and throwing milkshakes.  You should be able to auto shoot to make it any fun. Uninstalled after 1st go",A Google user,2,1.0.6,annoyance,,,
492,493,0.003588419,0.03521575,0.961195827,1,Fast Food Rampage,2017-01-07,Nice Game,"I'm loving Fast Food Rampage, just saying it would be cool if there was a mutiplayer mode. I think we all would injoy. And also add more weapons. I was thinking a milk shake lancher.",A Google user,5,1.0.6,love,,,
493,494,0.928559482,0.064552791,0.006887703,0,Fast Food Rampage,2017-01-07,It wont work for me,It is not working like i can get through the tutorial without ut crashing evry 10 seconds,A Google user,2,1.0.6,disapproval,,,
494,495,0.00374369,0.042312365,0.953943908,1,Fast Food Rampage,2017-01-07,,Really fun,A Google user,5,1.0.6,joy,,,
495,496,0.005098436,0.257889003,0.737012506,1,Fast Food Rampage,2017-01-07,Omg in love,Thanks gameranx,A Google user,5,,gratitude,,,
496,497,0.005574873,0.052588444,0.941836715,1,Fast Food Rampage,2017-01-07,,Just wowewwewwwweeeeeeeeeee,A Google user,5,1.0.6,surprise,,,
497,498,0.12290097,0.822627485,0.05447156,0,Fast Food Rampage,2017-01-06,Great,Been here since Ronald McDonald rampage.,A Google user,5,1.0.6,neutral,,,
498,499,0.946360886,0.049304962,0.004334087,0,Fast Food Rampage,2017-01-06,Awesome!,My one complaint is that it lags waaaaay to much.,A Google user,4,1.0.6,neutral,,,
499,500,0.012420005,0.054775808,0.932804167,1,Fast Food Rampage,2017-01-06,,Great  game  Kinda the same  thing  but fun as hell,A Google user,5,1.0.6,admiration,,,
500,501,0.017923642,0.410540313,0.571536005,1,Fast Food Rampage,2017-01-05,This game is mlg,I  like but can you make a 3D virshon,A Google user,5,1.0.6,love,,,
501,502,0.111601956,0.828292608,0.06010538,0,Fast Food Rampage,2017-01-05,,Mine exits after the tutorials,A Google user,1,,neutral,,,
502,503,0.414515465,0.501491845,0.08399266,0,Fast Food Rampage,2017-01-05,@ zi,"So based on the conveyor belt Its not hard sometimes but im not gonna bother with my life, i just cant be honest mate always been doing it for a smoke.",A Google user,2,1.0.6,approval,,,
503,504,0.959333062,0.034796204,0.005870767,0,Fast Food Rampage,2017-01-04,Average,Crap aiming and fairly boring.,A Google user,3,1.0.6,disappointment,,,
504,505,0.002910287,0.009307045,0.987782657,1,Fast Food Rampage,2017-01-02,,Loving this game!,A Google user,5,1.0.6,love,,,
505,506,0.575945318,0.379303962,0.044750787,0,Fast Food Rampage,2017-01-01,Good game,Awsome,A Google user,5,1.0.6,disgust,,,
506,507,0.003833316,0.045635905,0.950530767,1,Fast Food Rampage,2016-12-31,Amazing,Super addictive could play for hours,A Google user,5,1.0.6,approval,,,
507,508,0.895093799,0.093230002,0.011676106,0,Fast Food Rampage,2016-12-31,Bad,It always crashes,A Google user,1,1.0.6,neutral,,,
508,509,0.006032298,0.101586722,0.892381012,1,Fast Food Rampage,2016-12-29,Love the maniac fast food clown,Addictive with good variations of weapons and all sorts of enemies and levels. Strongly recommended,A Google user,5,1.0.6,approval,,,
509,510,0.957812846,0.038640067,0.003547135,0,Fast Food Rampage,2016-12-28,,After playing the tutorial it crashed then tried to load the game again and it crashed now I can't open the app without it crashing and I can't even push a single button before it crashes&lt;-,A Google user,1,1.0.6,neutral,,,
510,511,0.002481818,0.074874796,0.922643363,1,Fast Food Rampage,2016-12-27,,Cool music,A Google user,5,1.0.6,joy,,,
511,512,0.073792703,0.742272794,0.18393445,1,Fast Food Rampage,2016-12-26,,Needs Ronald MacDonald suite!,A Google user,5,1.0.6,neutral,,,
512,513,0.051268972,0.165679306,0.783051789,1,Fast Food Rampage,2016-12-25,Fun,It's really fun but could use a better story,A Google user,4,1.0.6,amusement,,,
513,514,0.002411514,0.009345496,0.988243043,1,Fast Food Rampage,2016-12-25,it is soooo much fun,it is the best game I have ever played,A Google user,5,1.0.6,joy,,,
514,515,0.014571379,0.064902581,0.920526028,1,Fast Food Rampage,2016-12-24,,Love it,A Google user,5,1.0.6,love,,,
515,516,0.001776473,0.011358485,0.986864984,1,Fast Food Rampage,2016-12-24,So good,So funny and addicting make more like this great game,A Google user,5,1.0.6,amusement,,,
516,517,0.013711784,0.226483241,0.759804964,1,Fast Food Rampage,2016-12-23,Fun,Fun,A Google user,5,1.0.6,amusement,,,
517,518,0.685332656,0.283532172,0.03113522,0,Fast Food Rampage,2016-12-23,Won't let me play,Once I get through the tutorial it crashes,A Google user,1,,neutral,,,
518,519,0.962247133,0.032522131,0.005230679,0,Fast Food Rampage,2016-12-22,Hell,This game sucks. Went through the tutorial only and cant play. Plez make this game to work I would rate this 5 stars later,A Google user,1,1.0.6,annoyance,,,
519,520,0.018537104,0.087282404,0.894180536,1,Fast Food Rampage,2016-12-22,,Love  it,A Google user,5,1.0.6,love,,,
520,521,0.002453533,0.02447693,0.973069549,1,Fast Food Rampage,2016-12-22,Brilliant,Brill game super fun download now,A Google user,5,1.0.6,excitement,,,
521,522,0.106747814,0.200431183,0.692820966,1,Fast Food Rampage,2016-12-22,,I would love to give this game 5 stars as it is fun and addictive. Unfortunately you can not exit the game. You need to go to home screen and close it through active apps.   It could also do with a syncing option. It was accidently uninstalled and now I have to start again. Not a big problem as I like the game.,A Google user,3,1.0.6,love,,,
522,523,0.160538182,0.678065538,0.16139625,1,Fast Food Rampage,2016-12-21,,10-Oct,A Google user,5,1.0.6,neutral,,,
523,524,0.788237274,0.198952511,0.012810152,0,Fast Food Rampage,2016-12-21,Stupid,It wont let me play,A Google user,1,,neutral,,,
524,525,0.701646268,0.281165868,0.017187851,0,Fast Food Rampage,2016-12-20,,It won't let me paly it.,A Google user,2,1.0.5,neutral,,,
525,526,0.005811102,0.025405267,0.968783617,1,Fast Food Rampage,2016-12-20,,Amazing and so fanny game. Thank you,A Google user,5,1.0.4,admiration,,,
526,527,0.002936235,0.011752504,0.98531127,1,Fast Food Rampage,2016-12-20,Best mobile game ever,It is really fun and funny could use more Content but other then that it is great keep up the good work,A Google user,5,1.0.5,admiration,,,
527,528,0.07372538,0.851384938,0.074889652,1,Fast Food Rampage,2016-12-20,Like it!,Need more variation on the available mission,A Google user,4,1.0.4,desire,,,
528,529,0.405625045,0.522552252,0.071822695,0,Fast Food Rampage,2016-12-19,Addicting,Addicting,A Google user,5,1.0.4,neutral,,,
529,530,0.839022398,0.148919791,0.012057835,0,Fast Food Rampage,2016-12-19,Obesetiy,Fun murdering people with food (git diabetes),A Google user,5,1.0.4,neutral,,,
530,531,0.468496889,0.379701942,0.151801199,0,Fast Food Rampage,2016-12-19,Andre,Because  I  like  to  make  people  fat and make  them  blow up,A Google user,5,1.0.4,neutral,,,
531,532,0.262997895,0.553171337,0.183830723,0,Fast Food Rampage,2016-12-19,,Meh,A Google user,2,1.0.4,neutral,,,
532,533,0.005704042,0.069000013,0.925295949,1,Fast Food Rampage,2016-12-19,Absolutely fun,Good game to kill time. Saw the video on YouTube.,A Google user,4,1.0.4,admiration,,,
533,534,0.091908358,0.751623988,0.156467691,1,Fast Food Rampage,2016-12-19,,Pizza11,A Google user,5,1.0.4,neutral,,,
534,535,0.012272467,0.070343442,0.917384088,1,Fast Food Rampage,2016-12-19,Game is broken but i love it!!!,"So ive unlocked all the weapons and have played a decent ammount of the game - enough to get  to 2nd place on the suburbia all time records and top 20 on the other 2 maps. However I open up the game this afternoon to find that all my stuff that i have unlocked has gone, completely wiped. However my high scores are still there so thats enough proof. I mean absolutely everything, all my levels that i have unlocked, cosmetic item and weapons- exept my stats and achievements. Plx fix as i love this game. :)",A Google user,3,1.0.4,admiration,,,
535,536,0.674886465,0.308241695,0.016871791,0,Fast Food Rampage,2016-12-19,Hated it,Because it kept turning off,A Google user,1,1.0.4,neutral,,,
536,537,0.001495776,0.007996779,0.990507483,1,Fast Food Rampage,2016-12-18,,This game is the best in the world  ♡,A Google user,5,1.0.4,admiration,,,
537,538,0.888276994,0.077883936,0.033839151,0,Fast Food Rampage,2016-12-18,,Dumb stupid and idiotic... AND I LOVE IT!,A Google user,5,1.0.4,love,,,
538,539,0.016155155,0.063834481,0.920010328,1,Fast Food Rampage,2016-12-18,Addictive and fun,My new favorite moble game. All this needs is more content and a few bug fixes.,A Google user,5,1.0.4,joy,,,
539,540,0.002626995,0.00859185,0.988781214,1,Fast Food Rampage,2016-12-18,So fun,This game is soooo fun to play,A Google user,5,1.0.4,joy,,,
540,541,0.045749478,0.744443178,0.209807351,1,Fast Food Rampage,2016-12-18,I watched mchatred on youtube so basiacally it,So i watchd mcdonalds rampage on mashed on youtjbe so yeah,A Google user,5,,neutral,,,
541,542,0.001776523,0.006621033,0.99160248,1,Fast Food Rampage,2016-12-17,,I love the music in the background and I love the theme of the game.,A Google user,5,1.0.4,love,,,
542,543,0.001936467,0.013919952,0.984143615,1,Fast Food Rampage,2016-12-17,,Best top down wave game I've played. it's even better than cod zombies on the phone.,A Google user,5,1.0.4,admiration,,,
543,544,0.014571379,0.064902581,0.920526028,1,Fast Food Rampage,2016-12-17,,Love it,A Google user,5,1.0.4,love,,,
544,545,0.300441891,0.592196643,0.107361376,0,Fast Food Rampage,2016-12-17,lost stuff.,ahhh........but it's not your fault,A Google user,3,1.0.4,neutral,,,
545,546,0.006989851,0.474564463,0.518445611,1,Fast Food Rampage,2016-12-17,Liked it but,Add multiplayer so people can play online,A Google user,4,1.0.4,neutral,,,
546,547,0.012342813,0.099819973,0.887837172,1,Fast Food Rampage,2016-12-16,,Just pure fun,A Google user,5,1.0.3,joy,,,
547,548,0.976314366,0.021178782,0.002506842,0,Fast Food Rampage,2016-12-16,Good game,But 4 stars because of this annoying glitch where you cant click the map to play making me reopen the app which is very annoying,A Google user,4,1.0.4,annoyance,,,
548,549,0.140345007,0.245340362,0.614314616,1,Fast Food Rampage,2016-12-15,Love it,"Love that classic high pack explosive game, entraining and fun. Problem is if you get out or get out it doesn't save the progress so you lose everything.",A Google user,4,1.0.4,love,,,
549,550,0.002099391,0.018085551,0.979815006,1,Fast Food Rampage,2016-12-15,Best game,Best game of the year,A Google user,5,1.0.4,admiration,,,
550,551,0.674478412,0.23944965,0.086071946,0,Fast Food Rampage,2016-12-15,Joysticks,Love the game but my controls get stuck i think its just my cracked screen messing with the touch screen,A Google user,3,1.0.4,love,,,
551,552,0.184978545,0.724035323,0.09098614,0,Fast Food Rampage,2016-12-15,Interesting,"It's exactly like that animation, can't remember what it was though",A Google user,4,1.0.4,realization,,,
552,553,0.428299844,0.524253488,0.047446676,0,Fast Food Rampage,2016-12-15,Lot of fun,Iv spent to much time in it,A Google user,5,1.0.4,neutral,,,
553,554,0.007028647,0.018490726,0.974480629,1,Fast Food Rampage,2016-12-15,,AWESOME GAME...YOU GUYS ARE GENIUSES,A Google user,5,1.0.4,admiration,,,
554,555,0.247698069,0.256901443,0.495400518,1,Fast Food Rampage,2016-12-14,Ver Fun,Love this hatred parody lol,A Google user,5,1.0.4,amusement,,,
555,556,0.001670293,0.036298107,0.962031662,1,Fast Food Rampage,2016-12-14,Grand. Slam,"Fast, fun, and free I'll play it evey day!",A Google user,5,1.0.4,joy,,,
556,557,0.60814476,0.331114352,0.060740903,0,Fast Food Rampage,2016-12-14,,Down with hipsters!,A Google user,5,1.0.4,neutral,,,
557,558,0.554926515,0.419910133,0.025163382,0,Fast Food Rampage,2016-12-14,Alright,Can get adictive but does need work,A Google user,4,,disapproval,,,
558,559,0.00833755,0.083822198,0.907840252,1,Fast Food Rampage,2016-12-14,,Awesome,A Google user,5,,admiration,,,
559,560,0.852891564,0.131861016,0.015247451,0,Fast Food Rampage,2016-12-13,Lost all my stuff,I had gotten very weapon in the game and had 6 helmets and 3 bodies and lost it all. Quite mad after spending all that time.,A Google user,1,1.0.4,sadness,,,
560,561,0.774466336,0.21318242,0.012351234,0,Fast Food Rampage,2016-12-13,,Won't let me play the game when I start it up,A Google user,1,1.0.4,neutral,,,
561,562,0.156343028,0.74063611,0.103020877,0,Fast Food Rampage,2016-12-13,Stolen Money,"Had 5000 coins, paid for 30k coins. When payment finished had 28k coins.  First and last time I pay for a free to play.",A Google user,1,1.0.4,neutral,,,
562,563,0.148419052,0.764814258,0.086766727,0,Fast Food Rampage,2016-12-12,Chaos.,Its a lot like the Mashed short of the same name except with a mime instead of Ronald.,A Google user,5,1.0.4,neutral,,,
563,564,0.093021207,0.17487371,0.732105076,1,Fast Food Rampage,2016-12-12,It cool,I thought it was going to kinda boring but I'm having a blast playing it,A Google user,4,1.0.4,joy,,,
564,565,0.008846232,0.075487569,0.915666223,1,Fast Food Rampage,2016-12-12,,Good game,A Google user,4,,gratitude,,,
565,566,0.002724859,0.02114238,0.97613281,1,Fast Food Rampage,2016-12-12,,Its super fun,A Google user,5,1.0.4,joy,,,
566,567,0.007936693,0.200850084,0.791213214,1,Fast Food Rampage,2016-12-12,Trash,Not many maps not many characters  add more and I will rate higher😊,A Google user,1,1.0.4,approval,,,
567,568,0.001661386,0.024888998,0.973449647,1,Fast Food Rampage,2016-12-12,Best,Best mobile game played in the last years!,A Google user,5,1.0.4,admiration,,,
568,569,0.002570864,0.023954079,0.973475099,1,Fast Food Rampage,2016-12-12,,Thank you for making this game,A Google user,5,,gratitude,,,
569,570,0.015991541,0.097684756,0.88632369,1,Fast Food Rampage,2016-12-12,,"Everything Is awesome, but it needs a multiplayer, more maps, different characters, different enemies, bosses and of course, MORE WEAPONS",A Google user,5,1.0.4,admiration,,,
570,571,0.018393505,0.101411186,0.88019532,1,Fast Food Rampage,2016-12-11,MCRampage,5his game is a great parody and glad the MCRAMPAGE short got a game,A Google user,5,1.0.4,admiration,,,
571,572,0.619431496,0.342042685,0.038525775,0,Fast Food Rampage,2016-12-11,Great time killer.,Very bizarre also.,A Google user,5,1.0.4,surprise,,,
572,573,0.808256745,0.150322199,0.041421078,0,Fast Food Rampage,2016-12-11,Meh,Great music but the playing experience isen't all that fun. The controlls are really clunky,A Google user,3,1.0.3,admiration,,,
573,574,0.001682285,0.010444887,0.987872839,1,Fast Food Rampage,2016-12-11,,"Fun and addicting, very nice game with some very good music and sound effects",A Google user,5,1.0.4,joy,,,
574,575,0.970222175,0.026221478,0.003556299,0,Fast Food Rampage,2016-12-11,Eat burger and shut up,Damn you vegen with all your stupid greens,A Google user,5,1.0.3,annoyance,,,
575,576,0.919377089,0.069760397,0.010862527,0,Fast Food Rampage,2016-12-11,Grindfest with terrible payoff,"Everything that's unlocked past the 50% speed boost and sliders feels awful for how much grinding is put into them. The wave progression also feels horrible since enemies begin to turn into damage sponges by wave 10, while also increasing in numbers as well. As a joke game to play when bored, it's alright, but it sure becomes quite time consuming and boring. Even the power ups begin to scale horribly in the later waves, making them risky to grab with enemies firing at you while animation locked.",A Google user,1,1.0.3,disgust,,,
576,577,0.009900875,0.081695341,0.908403754,1,Fast Food Rampage,2016-12-11,,It's fun,A Google user,5,1.0.4,joy,,,
577,578,0.024527112,0.108417027,0.867055893,1,Fast Food Rampage,2016-12-11,Really addictive,Can't stop playing!,A Google user,5,,amusement,,,
578,579,0.002284783,0.012376845,0.98533833,1,Fast Food Rampage,2016-12-11,Fat,Its fun and good it's perfect,A Google user,5,1.0.4,admiration,,,
579,580,0.003149773,0.009159612,0.987690687,1,Fast Food Rampage,2016-12-11,,"Love it, super fun game",A Google user,5,1.0.4,excitement,,,
580,581,0.002060357,0.00695588,0.990983725,1,Fast Food Rampage,2016-12-11,FUN,It was great. The game was crazy and awesome!,A Google user,4,,admiration,,,
581,582,0.736380279,0.216115177,0.047504488,0,Fast Food Rampage,2016-12-11,What is wrong with this?!,"This game is fun but i lost my all coins, guns and cities. I don't know why. Needs improvement right now.",A Google user,1,,amusement,,,
582,583,0.004246307,0.009250719,0.986503005,1,Fast Food Rampage,2016-12-11,Clown shooter,I love the game,A Google user,5,,love,,,
583,584,0.005578416,0.015971201,0.978450358,1,Fast Food Rampage,2016-12-10,Cool!,"This is great! Mashed sent me here, and I was not disappointed. The controls are a bit difficult, but nonetheless it's an awesome, hipster-slaying game!",A Google user,5,,admiration,,,
