Id,roberta_neg,roberta_neu,roberta_pos,roberta_polarity,Source,Date,Title,Content,Name,Rating,Version,emotion
740,0.876571238,0.115182266,0.008246415,0,MyPlate Calorie Tracker,2022-03-14,,Use to use this app all the time when i was working out and dieting then got away from that now that ive started wanting 2 track my stuff again i redownloaded the app and went 2 log in and said my password was no good i do the oassword reset and dont recieve a email to do it even checked the spam folder and no email so cant use the app.,Jeffrey Kurzyniec,2,3.5.3(63),realization
741,0.037749931,0.316496909,0.645753145,1,MyPlate Calorie Tracker,2022-03-14,,Good free app ads are minimunal and has built in reminders,Hunter Kennedy,5,3.5.3(63),neutral
742,0.002044993,0.018019371,0.979935646,1,MyPlate Calorie Tracker,2022-03-13,,"It really helps me see how much of what I consume and what I have to change to reduce or increase. It's really easy to use, too and helps with the caloric deficit. I'm really happy with it! :]",rain_,5,3.5.3(63),joy
743,0.008274307,0.081088565,0.91063714,1,MyPlate Calorie Tracker,2022-03-13,,I had to add some foods because the calories were different than my brand but overall counts are good and the app is easy to use,gerry kemp,5,3.5.3(63),approval
744,0.339710355,0.26990965,0.390379965,1,MyPlate Calorie Tracker,2022-03-12,,"Really loved the App. Had been using it since November 2021 and then, just today, ALL my food log data prior to yesterday disappeared. Very upset!!!!!",Illyse Zesch,1,3.5.3(63),love
745,0.000979084,0.020997256,0.978023708,1,MyPlate Calorie Tracker,2022-03-11,,"My favorite calorie tracker, has helped me reach my goals FAST",『Hoshiぞら』,5,3.5.3(63),joy
746,0.532392323,0.400433868,0.067173861,0,MyPlate Calorie Tracker,2022-03-10,,Can't register for account. Shouldn't be that hard. Oh well,ginny crosser,1,,neutral
747,0.003158674,0.111931868,0.884909451,1,MyPlate Calorie Tracker,2022-03-10,,"Been using for about 9 months, amazing for tracking calories",Kristoff Pragg,5,3.5.3(63),admiration
748,0.004649982,0.150015503,0.84533453,1,MyPlate Calorie Tracker,2022-03-10,,So far it's found everything I've eaten and it's fairly easy to move around and add stuff,Jim Axtell,5,3.5.3(63),neutral
749,0.033833228,0.267107487,0.699059308,1,MyPlate Calorie Tracker,2022-03-10,,Great,B_24,5,3.5.3(63),admiration
750,0.002102959,0.019945573,0.977951527,1,MyPlate Calorie Tracker,2022-03-10,,helpfull app thank you,Barry Ramos,5,3.5.3(63),gratitude
751,0.003221652,0.051910628,0.944867671,1,MyPlate Calorie Tracker,2022-03-09,,Great way to track my intake. Easy option is my fav.,Randy Cates,5,3.5.3(63),admiration
752,0.003348866,0.023507981,0.97314316,1,MyPlate Calorie Tracker,2022-03-09,,So easy to use and the reminders are excellent.,Rob,5,3.5.3(63),admiration
753,0.005482761,0.100915633,0.893601596,1,MyPlate Calorie Tracker,2022-03-08,,"Easy to use, customizeable.",Stacey Garrison,5,3.5.3(63),neutral
754,0.006155144,0.043387912,0.950456977,1,MyPlate Calorie Tracker,2022-03-08,,Great app,Duke The Dumpster Official,5,3.5.3(63),admiration
755,0.004015967,0.294953734,0.701030314,1,MyPlate Calorie Tracker,2022-03-07,,Helping me make more conscious food choices.,Emily Hamby,4,3.5.3(63),approval
756,0.002262416,0.059975188,0.93776238,1,MyPlate Calorie Tracker,2022-03-07,,Works great to track macros,Joseph Williams,5,3.5.3(63),admiration
757,0.054551467,0.142236128,0.803212464,1,MyPlate Calorie Tracker,2022-03-06,,"It's a great app overall for basic tracking and meal prep, you can add food yourself too which just makes it even better. Only major downside is that the premium version is locked behind a monthly fee instead of just a one time payment which is much better suited for an app like this. If the option was available I would have paid for it years ago.",Joshua Toeppe,4,3.5.3(54),admiration
758,0.006306621,0.058864065,0.934829354,1,MyPlate Calorie Tracker,2022-03-04,,"Easy to use, and I like that you don't have to use the pay version to get a lot of value out of the product",Bonnie Gruenberg,5,3.5.3(63),approval
759,0.006389131,0.064982533,0.928628325,1,MyPlate Calorie Tracker,2022-03-04,,It's helping me. Wish there was more variety in foods but glad I can enter my own. I like it better than My Fitness Pal.,Sonya Long,5,3.5.3(63),desire
760,0.824085832,0.167552322,0.008361804,0,MyPlate Calorie Tracker,2022-03-03,,It wouldn't let me sign up,Linda Spain,1,,disapproval
761,0.052558482,0.266826451,0.680615067,1,MyPlate Calorie Tracker,2022-03-02,,Fantastic,Taryn Tickell,5,3.5.3(63),admiration
762,0.168245882,0.480158776,0.351595342,1,MyPlate Calorie Tracker,2022-03-02,,Excellent,Linda Lee,5,3.5.3(63),admiration
763,0.928625166,0.066915661,0.004459197,0,MyPlate Calorie Tracker,2022-03-02,,The measurement options are extremely lacking compared to any other app,Mr Sand,2,3.5.3(63),disapproval
764,0.003056441,0.032542657,0.964400947,1,MyPlate Calorie Tracker,2022-03-02,,Fantastic and simple to use!,Amanda Snyder,5,3.5.3(63),admiration
765,0.005304826,0.118873164,0.875821948,1,MyPlate Calorie Tracker,2022-03-02,,"Very convience,easy to add foods on and search calories Thanks",Zhen Pan,5,3.5.3(63),gratitude
766,0.004662096,0.057541259,0.937796652,1,MyPlate Calorie Tracker,2022-03-02,,"I'm still new to the app, but so far is it very user friendly",Katie MacDonald,5,3.5.3(63),approval
767,0.002036039,0.088094667,0.909869254,1,MyPlate Calorie Tracker,2022-03-02,,Easy to use and helpful at keeping track of meals,Carly Cook,5,3.5.3(63),neutral
768,0.001988299,0.039918076,0.958093643,1,MyPlate Calorie Tracker,2022-03-01,,Fist day on good so far,Eric Mercado,5,3.5.3(63),joy
769,0.002251176,0.012172948,0.985575914,1,MyPlate Calorie Tracker,2022-03-01,,This is totally awesome.,john watkins,5,3.5.3(63),admiration
770,0.034032892,0.23463957,0.731327593,1,MyPlate Calorie Tracker,2022-02-28,,Wayy better than all others,Atomeon,5,3.5.3(63),admiration
771,0.149704829,0.456097752,0.394197404,1,MyPlate Calorie Tracker,2022-02-28,,Good app takes some getting used to,Kim Walzer,5,3.5.3(63),admiration
772,0.001420647,0.021145418,0.97743398,1,MyPlate Calorie Tracker,2022-02-27,,Extremely easy to use. Syncs well with Google Fit. Barcode scanner for food is great.,Judi Pryde,5,3.5.3(63),admiration
773,0.005745079,0.043920867,0.950334013,1,MyPlate Calorie Tracker,2022-02-27,,Good app.,Natasha Brockington,5,3.5.3(63),admiration
774,0.050841566,0.231933266,0.717225134,1,MyPlate Calorie Tracker,2022-02-26,,Looks nice but for the first item I tried adding there was only one size (3 oz.). I wanted to add 8 oz. I added 2.67 servings to get around the constraint but that's not efficient or completely accurate. Other items were easier to add. Layout seems decent. I will update my review after I gain more experience with the app. EDIT: gave it 1 more star for nicely syncing with Google Fit. EDIT 2: removed a star for not showing micronutrients (vitamins/minerals),Ryan,3,3.5.3(63),approval
775,0.039000694,0.238627866,0.722371459,1,MyPlate Calorie Tracker,2022-02-26,,Works exactly like I expected,J Carlos Razo,5,3.5.3(63),optimism
776,0.225019872,0.480497003,0.294483066,1,MyPlate Calorie Tracker,2022-02-26,,Why is there ads when the isn't anything that says 'contains ads' on the Appstore? It's still good tho,Grace T,4,3.5.3(63),admiration
777,0.002075792,0.029581297,0.968342841,1,MyPlate Calorie Tracker,2022-02-25,,"At first use in giving this 5 bc it makes adding new foods simple, the teaching interface is simple and fun to use, and you have to love the verified database of foods that allows you to easily find anything you've eaten",Tyler Spiegel,5,3.5.3(63),approval
778,0.002701346,0.028617872,0.968680799,1,MyPlate Calorie Tracker,2022-02-24,,I like the app.,R Pippin,5,3.5.3(63),love
779,0.001947394,0.008575602,0.989477038,1,MyPlate Calorie Tracker,2022-02-23,,Great app!! Pretty easy to use.,Brianna Lingren,5,3.5.3(63),admiration
780,0.031506017,0.626607835,0.341886103,1,MyPlate Calorie Tracker,2022-02-22,,Easy to add food.,Elisa Shiemke,5,3.5.3(63),neutral
781,0.593681931,0.341558456,0.064759567,0,MyPlate Calorie Tracker,2022-02-21,,"Overall, it's adequate, but it's not so great for tracking a Keto diet. The search algorithm for general meals and/or food items is confusing. I can do a search for sugar free ice cream bars but get 20 listings for cucumbers and ribeye steaks first before any ice cream products comes up.",Charlie Souby,3,3.5.3(63),disapproval
782,0.009020121,0.183111936,0.807867944,1,MyPlate Calorie Tracker,2022-02-21,,"Just the app I've been looking for, to index how much I've eaten through the day to meet up my weight gain target. Kudos 👍🏼",Doosu Bere,5,3.5.3(63),desire
783,0.002059494,0.012058003,0.985882521,1,MyPlate Calorie Tracker,2022-02-20,,This app is very useful and easy to use,Shahriar Suhan,5,3.5.3(63),approval
784,0.836315811,0.146702066,0.016982086,0,MyPlate Calorie Tracker,2022-02-20,,Expensive and autorenews without warning. Rip off,Chris Hammond,1,3.5.3(63),neutral
785,0.007726658,0.109381154,0.882892251,1,MyPlate Calorie Tracker,2022-02-19,,Easy to use app,Tater Tot,5,3.5.3(63),neutral
786,0.021860261,0.473038048,0.50510174,1,MyPlate Calorie Tracker,2022-02-19,,This is the way.,Jefferson,5,,neutral
787,0.014326404,0.195337549,0.790336072,1,MyPlate Calorie Tracker,2022-02-18,,Easy to Use,Dee Davis,4,3.5.3(63),neutral
788,0.004744248,0.022973008,0.972282767,1,MyPlate Calorie Tracker,2022-02-17,,Love it!,Beatriz Romero,4,3.5.3(63),love
789,0.594826996,0.366793334,0.03837974,0,MyPlate Calorie Tracker,2022-02-16,,This app used to be helpful for tracking nutrition but now a lot of the features I used to use are behind a paywall,Rob Woodward,1,3.5.3(63),realization
790,0.010846763,0.13742204,0.851731241,1,MyPlate Calorie Tracker,2022-02-16,,Easy to use & meets my expectations.,T. Anderson,5,3.5.3(63),approval
791,0.00637968,0.111428276,0.882192016,1,MyPlate Calorie Tracker,2022-02-15,,Easy and detailed app. Clear and Interactive,Kristi Wetherington,5,3.5.3(63),neutral
792,0.033833228,0.267107487,0.699059308,1,MyPlate Calorie Tracker,2022-02-15,,Great,Jeanette Esterhuizen,5,3.5.3(63),admiration
793,0.002873476,0.063908108,0.93321842,1,MyPlate Calorie Tracker,2022-02-15,,"Great free app, tracks calories and exercise and gives details of protein, fat, and carb content of the food you eat. Just what I was looking for and helps me get to my target weight.",Jonathan Crosswaite,5,3.5.3(63),admiration
794,0.002035933,0.018454744,0.979509354,1,MyPlate Calorie Tracker,2022-02-14,,"Incredible calorie tracking app! As a skinny guy trying to gain weight, I've been through several calorie tracking apps and this one is by far the best!!!",Dan Clark,5,3.5.3(63),admiration
795,0.005726449,0.081082135,0.913191378,1,MyPlate Calorie Tracker,2022-02-14,,"App works great for tracking callories and activity. It syncs with google fit to import steps, but other activities in Google fit like stationary biking, don't come over from fit and you have to manually enter them in MyPlate",Ray E,3,3.5.3(63),neutral
796,0.004234321,0.065642364,0.93012327,1,MyPlate Calorie Tracker,2022-02-13,,"Great meal and calorie tracker, with barcode scanner",Nicholas Pryde,5,,admiration
797,0.032518804,0.2003382,0.767142951,1,MyPlate Calorie Tracker,2022-02-13,,Great.,Edward Smith,5,3.5.3(63),admiration
798,0.007164252,0.110810027,0.882025719,1,MyPlate Calorie Tracker,2022-02-12,,Awesome tool to lose weight,Julie,5,3.5.3(63),admiration
799,0.014934164,0.184054554,0.801011264,1,MyPlate Calorie Tracker,2022-02-12,,Easy to use,Beverly Davis,5,3.5.3(63),neutral
800,0.001751547,0.008013729,0.990234733,1,MyPlate Calorie Tracker,2022-02-11,,"Love it!! Has nice list of already entered items that you can modify and you can enter your own. User friendly, easy to navigate and easy to read data. I'm very pleased. Thanks!!",Island Butterfly,5,3.5.3(63),gratitude
801,0.002848385,0.014589277,0.982562304,1,MyPlate Calorie Tracker,2022-02-11,,This honestly the best app for calorie counting I have found. I also love how it doesn't spy on you like similar apps. It is worth getting the premium.,Yaseen Zormati,5,3.5.3(63),admiration
802,0.001762604,0.068965085,0.929272294,1,MyPlate Calorie Tracker,2022-02-11,,It's helping me with my progress for a better self,Jonathan Manzanera,5,3.5.3(63),caring
803,0.01505521,0.094821632,0.890123188,1,MyPlate Calorie Tracker,2022-02-10,,"This is a solid app I've used off and on over many years. Originally, from a web page, this app has evolved to be something streamlined and efficient. Now that I can scan barcodes (and almost everything is in there), I can easily keep track of calories. It keeps track of specific nutrition so you know if you're actually eating right. Most items not listed have something very close, enough to find an appropriate calorie count. I've never even bothered to buy the paid version. Free works great!",Alli Spencer-Driden,5,3.5.3(63),approval
804,0.00407809,0.258409172,0.737512767,1,MyPlate Calorie Tracker,2022-02-10,,Easy to use and modify to help stay pn track and keep motivation up for calorie controk,Shannon Belanger,5,3.5.3(63),neutral
805,0.005992094,0.063783281,0.930224657,1,MyPlate Calorie Tracker,2022-02-09,,I tried so many calorie counting apps before I finally found this one that lets me just add quick calories without looking up a specific food! I appreciate it,Summer Gonzalez,5,3.5.3(63),admiration
806,0.006093704,0.172656149,0.821250141,1,MyPlate Calorie Tracker,2022-02-09,,Great for tracking macros.,Willis Dennison,5,3.5.3(63),admiration
807,0.001555644,0.009189194,0.98925519,1,MyPlate Calorie Tracker,2022-02-08,,"I've had this app for half a year now and it's help alot when it came to my fitness journey I also love all the different options it has when it come to tracking calories and nutrition, best app I've found so far when it comes to tracking calories plus there's an awesome online community that offers lots of support",Sammie Fidler,5,3.5.3(63),admiration
808,0.003522842,0.087879188,0.908597946,1,MyPlate Calorie Tracker,2022-02-07,,Its so helpful in courting my calories,Sharon Beatson,5,3.5.3(63),approval
809,0.014571379,0.064902581,0.920526028,1,MyPlate Calorie Tracker,2022-02-07,,Love it,Josie McCauley,5,3.5.3(63),love
810,0.002024054,0.027998079,0.969977856,1,MyPlate Calorie Tracker,2022-02-07,,"Works great, helps me keep track of all foods",Jacqueline Thomson,5,3.5.3(63),admiration
811,0.007084766,0.046142671,0.946772635,1,MyPlate Calorie Tracker,2022-02-07,,Love the ease of use.,Angela Kendrick,5,3.5.3(63),love
812,0.002291467,0.006576821,0.991131723,1,MyPlate Calorie Tracker,2022-02-07,,"Love the app so far, thank you",Wayne Nielsen,5,3.5.3(63),gratitude
813,0.309813023,0.380610079,0.309576958,0,MyPlate Calorie Tracker,2022-02-07,,Would've given 5 stars but there's an error in the app. Whenever I received a mail about my weekly progress it's different from my calorie intake according to the app. Example on Thursday I ate like 4200 calories according to app but only 3100 according to mail. Please fix this issue. Over-all a really great app.,Vibhav Nagarwal,4,,admiration
814,0.954769433,0.042465214,0.002765251,0,MyPlate Calorie Tracker,2022-02-04,,I was not asked anything repeatedly. Your site is a racist site and you didn't want African Americans there anyhow. I don't see you scolding people who say they have relapsed and gained 500 lbs but you cancel me because I said that I went 30 days on water only. You are just a bigot.,James West,1,3.5.3(63),annoyance
815,0.480711013,0.431712091,0.087576903,0,MyPlate Calorie Tracker,2022-02-04,,"An alpha sort for foods needed. Also differentiation between foods for breakfasts, lunches and dinners would also be useful. One year later: no changes made. App remains difficult to use.",Paula Corman,3,3.5.3(63),neutral
816,0.002605648,0.014724978,0.982669353,1,MyPlate Calorie Tracker,2022-02-03,,"Pretty good, food selection could be more but honestly the best Ive found",Meli Malone,5,3.5.3(63),admiration
817,0.033436708,0.39115715,0.575406134,1,MyPlate Calorie Tracker,2022-02-03,,Seems to be doing everything I need it to.,Bradley Eaton,5,3.5.3(63),approval
818,0.060904544,0.203268081,0.735827386,1,MyPlate Calorie Tracker,2022-02-02,,I like that it's easy to use and unlike other apps you don't have to upgrade to use the food calorie tracker. I been having a hard time losing weight and now I know why. My portions are small but o boy my selections of food explains what my problem is. I'm confident that with intermittent fasting & this app I'll finally reach my goal weight!,Lola Lewis,5,3.5.3(63),approval
819,0.894895852,0.097102165,0.008001959,0,MyPlate Calorie Tracker,2022-02-02,,App is buggy. Not tracking each day meals. New day I'm seeing record of day before. Cannot review anything past yesterday for meal details,Bill McCracken,2,3.5.3(63),neutral
820,0.007598377,0.035260946,0.957140684,1,MyPlate Calorie Tracker,2022-02-02,,Amazing weight loss app. I probably would have been lost without it. There's no other app I've tried that's nearly as good and I'll definitely be recommending it to friends/family.,Cr0w,5,3.5.3(63),admiration
821,0.00132875,0.009448497,0.989222765,1,MyPlate Calorie Tracker,2022-02-02,,I really like this app. Since I committed to losing weight this app has done a great job at helping me keep my diet organized and making sure I'm meeting my goals.,Winston Watson,4,3.5.3(63),admiration
822,0.001789176,0.020168625,0.978042185,1,MyPlate Calorie Tracker,2022-02-02,,So far I am liking the app.,Belencita 29,5,3.5.3(63),love
823,0.002578199,0.113274649,0.884147167,1,MyPlate Calorie Tracker,2022-02-02,,Loads of foods in the database and easy to create meals make journaling easy and fast!,Celeste Atkins,5,3.5.3(63),neutral
824,0.014934164,0.184054554,0.801011264,1,MyPlate Calorie Tracker,2022-02-02,,Easy to use,TJ Garver,5,3.5.3(63),neutral
825,0.00833755,0.083822198,0.907840252,1,MyPlate Calorie Tracker,2022-02-01,,Awesome,Jimmie mae Long,5,3.5.3(63),admiration
826,0.001713005,0.031560235,0.96672678,1,MyPlate Calorie Tracker,2022-02-01,,Best app for tracking my food and exercise. I also like that there is a community for support and food ideas.,Annette Hankins,5,3.5.3(63),admiration
827,0.002699219,0.019373232,0.977927566,1,MyPlate Calorie Tracker,2022-01-30,,Great app!,Garrett Miller,5,3.5.3(63),admiration
828,0.716971695,0.236593843,0.046434473,0,MyPlate Calorie Tracker,2022-01-30,,"A big help cutting calories, but recently it is often loading the wrong day. Very frustrating becausd you tgen gave to delete the entries and move to the correct day.",Barbara McElroy,4,3.5.3(63),annoyance
829,0.003950043,0.028122654,0.967927337,1,MyPlate Calorie Tracker,2022-01-30,,So far so good. No complaints,RM,5,3.5.3(63),approval
830,0.426558256,0.443884104,0.129557669,0,MyPlate Calorie Tracker,2022-01-30,,Geeat,Corey Barber,5,3.5.3(63),neutral
831,0.004237427,0.06598188,0.929780722,1,MyPlate Calorie Tracker,2022-01-29,,Good so far,Stuart Stevens,4,3.5.3(63),optimism
832,0.050852932,0.69897157,0.250175565,1,MyPlate Calorie Tracker,2022-01-29,,Thats what i am looking for.,Asad Saeed,5,3.5.3(63),desire
833,0.002076145,0.008005535,0.989918292,1,MyPlate Calorie Tracker,2022-01-29,,"So far, so good. I love how plentiful the all is. It has everything I need.",Denee Frelich,4,3.5.3(63),love
834,0.548610449,0.336086214,0.115303285,0,MyPlate Calorie Tracker,2022-01-28,,"Been using this app for around 2 years. But one thing that drives me absolutely crazy is the fact that since the bar code scan/food search has very little results/accuracy, I have to just make almost everything in the &quot;my food&quot; section myself and I always have a humongous list of food quickly. I highly recommend someone release a update with a search bar at least, in the my food spot, as literally no one has time to actually go item by item on their &quot;my food&quot; until they find what they need.",Nathaniel Tari,2,3.5.3(63),joy
835,0.687606871,0.264713079,0.047680032,0,MyPlate Calorie Tracker,2022-01-28,,"this used to be my favourite fitness app, but the &quot;custom&quot; calorie intake is no longer custom. it won't let you type in any amount below 1200 despite your doctor's advice. you'd be better off using a notebook & pen",Lyric Village,1,3.5.3(54),approval
836,0.001953942,0.006734776,0.991311312,1,MyPlate Calorie Tracker,2022-01-28,,Great app love it its helped out so much,midwes79 sharp,5,3.5.3(63),admiration
837,0.092265204,0.511525273,0.396209508,1,MyPlate Calorie Tracker,2022-01-27,,Easy,Todd Black,5,3.5.3(63),neutral
838,0.40278554,0.491714656,0.105499819,0,MyPlate Calorie Tracker,2022-01-26,,"I'm still learning my way around the app and I wish it was easier to log things like a shepards pie , where there are multiple ingredients and only 1 1/2 cups eaten",Trista M,4,3.5.3(63),desire
839,0.006753114,0.073024385,0.920222461,1,MyPlate Calorie Tracker,2022-01-26,,So easy to use,Colleen Reilly,5,3.5.3(63),approval
840,0.017141247,0.180515438,0.802343249,1,MyPlate Calorie Tracker,2022-01-25,,Works perfectly,Carlos Feyder,5,3.5.3(63),admiration
841,0.002319961,0.101908356,0.895771682,1,MyPlate Calorie Tracker,2022-01-25,,Healthy lifestyle 😁,Abdulaziz Alosaimi,5,3.5.3(63),approval
842,0.223808557,0.367107958,0.409083456,1,MyPlate Calorie Tracker,2022-01-25,,"I really liked the app, but need the fat calculated separately and I can't afford the monthly plan",Lynessa Hendrick,4,3.5.3(59),disapproval
843,0.00514441,0.15495865,0.839896917,1,MyPlate Calorie Tracker,2022-01-25,,It's a good way to monitor your macros and calories,Sarah Lewis,5,3.5.3(63),neutral
844,0.009491394,0.198843285,0.791665375,1,MyPlate Calorie Tracker,2022-01-24,,Clear and easy to use,josen1262,5,3.5.3(63),neutral
845,0.001506122,0.020121839,0.978372037,1,MyPlate Calorie Tracker,2022-01-24,,"I am a model and singer and need to maintain a certain weight. This is the only app I use to track all my calories... Have been a member since 2015! Thank you MyPlate... It's a beautiful, simple app to use!",Jazzmine Faith,5,3.5.3(63),admiration
846,0.001909371,0.013784378,0.984306216,1,MyPlate Calorie Tracker,2022-01-24,,"Super pleased, I am already loving this app! Naturally I have connected it to my Google Fit account, and get my calories added for me by scanning barcodes of my food! (It can also be done manually, of course.) I wasn't even really going in it for weight loss, specifically, just kind of pre- budget watching where my food adds up and how much and how quickly, realistically. Now I'm super motivated and optimistic about my new goals!!!",Kell Dubs,5,3.5.3(63),optimism
847,0.007553866,0.095074177,0.897371948,1,MyPlate Calorie Tracker,2022-01-24,,"easy to use, convenient.",Mary Ann Hull,5,,neutral
848,0.002350975,0.010557954,0.987091064,1,MyPlate Calorie Tracker,2022-01-24,,I love this app and have become more of a disciplined eater because of it. I am really impressed by how I am able to track my sodium intake. Just what the Dr. ordered!!!,Janie Davis,5,3.5.3(63),admiration
849,0.006178288,0.054947067,0.938874602,1,MyPlate Calorie Tracker,2022-01-24,,Love that I can scan in food to keep track! Still use over 4 year later.,Yolanda,5,3.5.3(63),love
850,0.010516488,0.172125161,0.817358315,1,MyPlate Calorie Tracker,2022-01-24,,Excellent platform,Veena's Kitchen,5,3.5.3(63),admiration
851,0.003357146,0.046154544,0.950488329,1,MyPlate Calorie Tracker,2022-01-23,,This app has helped me keep track on my weight loss journey I've had no issues or bugs with it,Nathan Culbertson,5,3.5.3(63),approval
852,0.312978536,0.415080696,0.271940798,0,MyPlate Calorie Tracker,2022-01-23,,"I like the app when it works. I have a Samsung s21 ultra, app seems to work 90% of the time when I'm logging food/exercise with our crashing. However, when I'm trying to go back and look at previous days I can look back 2 or 3 days and the app crashes. It seems like when it's not working you get 3-5 taps or swipes before it crashes. I have updated Android and tried uninstalling and reinstalling the app and it's the same.",Dawna H,3,3.5.3(63),love
853,0.074008167,0.196381196,0.729610682,1,MyPlate Calorie Tracker,2022-01-22,,Loved it but am trying to lose weight so wanted to do the 800 calorie a day diet as per Michael Moseley. It now won't let me enter below 1200. Been using this app for over a year now and love it but will be looking for a different one.,Lulu 000,3,3.5.3(63),love
854,0.002050866,0.012866779,0.985082388,1,MyPlate Calorie Tracker,2022-01-22,,"Best free calorie tracker app hands down! I started using this app Dec 27, 2021 when I decided to get serious about my weight and so far it's helped me lose 11 pounds (along with exercise)! I'm on a 1000 calorie diet and I'm sooo thankful for this app helping me track my calorie intake. Only thing I wish that it did is to let me customize my calorie intake limit to 1000. Either way, Thank you guys!",curly ceibeña,5,3.5.3(63),gratitude
855,0.005305784,0.057309676,0.937384486,1,MyPlate Calorie Tracker,2022-01-21,,Awesome 👍,Chris Ernstes,5,3.5.3(63),admiration
856,0.02498938,0.197836623,0.777173996,1,MyPlate Calorie Tracker,2022-01-21,,"Neat app. It definitely forces me to pay attention to what I eat. And since I routinely don't eat enough protein, I am hopeful that this will help.",Ginny Cattermole,5,3.5.3(63),optimism
857,0.00150277,0.006933852,0.99156332,1,MyPlate Calorie Tracker,2022-01-18,,I really enjoy using this app!,Rowena Ndakwe,5,3.5.3(63),joy
858,0.002613867,0.039084878,0.958301246,1,MyPlate Calorie Tracker,2022-01-16,,Awesome app for calorie tracking,Jeremiah Mynatt,5,3.5.3(63),admiration
