Id,roberta_neg,roberta_neu,roberta_pos,roberta_polarity,Source,Date,Title,Content,Name,Rating,Version,emotion
2129,0.049035851,0.189594597,0.761369526,1,MyPlate Calorie Tracker,2020-11-19,,"Great app that has really helped me, but it's missing lots of food and sometimes the calorie counting isn't accurate. Yesterday I had 2500 steps and it said I had burned zero calories for example.",Sam Sam,4,,admiration
2130,0.004692439,0.115790509,0.879517019,1,MyPlate Calorie Tracker,2020-11-19,,Tracking gives you the facts about your dietary habits! I lost over 35 pounds using this tool to remind me. Praise the Lord!,John Goodman,5,,pride
2131,0.003194098,0.074793734,0.92201221,1,MyPlate Calorie Tracker,2020-11-19,,Helps me stay on my calorie target. Very user friendly,Ruben diaz,5,3.5.3(43),approval
2132,0.009658222,0.184600532,0.805741191,1,MyPlate Calorie Tracker,2020-11-19,,Great for tracking,Dennis Earl,5,3.5.3(43),admiration
2133,0.106322713,0.403231323,0.490446001,1,MyPlate Calorie Tracker,2020-11-19,,Woooow,jen santiago,5,3.5.3(43),excitement
2134,0.012308517,0.05368524,0.934006214,1,MyPlate Calorie Tracker,2020-11-18,,Just love it,betzaida jimenez,5,3.5.3(43),love
2135,0.001365063,0.010209232,0.988425732,1,MyPlate Calorie Tracker,2020-11-18,,"I love this app, its been amazing for helping me count calories, track my success with weight loss and track my macros for keto",W H,5,3.5.3(43),admiration
2136,0.108123288,0.318217188,0.57365948,1,MyPlate Calorie Tracker,2020-11-18,,It's easy to use and links well with the exercise tracking app too. The only bad thing is when looking up foods there are so many variations of the same foods that it takes a while to build up your personal library. But thumbs up on the calorie tracking.,Sam Attias,4,3.5.3(43),neutral
2137,0.74044472,0.246371791,0.01318353,0,MyPlate Calorie Tracker,2020-11-18,,Struggled doesn't always record walks runs etc annoyed,Steve,3,3.5.3(43),annoyance
2138,0.725150526,0.259379238,0.015470215,0,MyPlate Calorie Tracker,2020-11-18,,"All of a sudden it won't register my activity, it says I need to enable activity recognition in the settings but there are no settings for that.",rachie342004,1,3.5.3(43),realization
2139,0.006047081,0.036498506,0.957454443,1,MyPlate Calorie Tracker,2020-11-18,,Great app. Not glitchy and has multiple uses.,Samuel Jackson,5,,admiration
2140,0.001971385,0.018686377,0.979342282,1,MyPlate Calorie Tracker,2020-11-18,,Setup and use is very easy. So far I like it,Ray Houck,5,3.5.3(8),love
2141,0.943667948,0.052269164,0.004062793,0,MyPlate Calorie Tracker,2020-11-18,,Crashes a lot. Log out and in daily to fix. Also export of data is garbage,Craig Mann,1,3.5.3(8),neutral
2142,0.001776097,0.04413306,0.954090834,1,MyPlate Calorie Tracker,2020-11-18,,It really helps me keep track very well,Tammy Angel,5,3.5.3(43),approval
2143,0.001282542,0.025500664,0.973216772,1,MyPlate Calorie Tracker,2020-11-17,,I lost 1.8 kg within 20 days with following this app 😌 It's very helpful,Jannatun Naim Toa,5,3.5.3(8),approval
2144,0.111105092,0.452853084,0.436041832,1,MyPlate Calorie Tracker,2020-11-17,,Does the job. Can't complain,Artur,5,3.5.3(43),neutral
2145,0.00221708,0.063559644,0.934223354,1,MyPlate Calorie Tracker,2020-11-17,,App is easy to use and helps keep me on track with food intake and prompts me to drink water.,Denise Thompson,5,3.5.3(8),neutral
2146,0.025014732,0.128097042,0.846888185,1,MyPlate Calorie Tracker,2020-11-17,,"This application has been fantastic and an awesome tool to help me with my dietary goals. Being a vegan, I've come to find that a balanced macro/micronutrient profile is very difficult to maintain and likely impossible for anyone not paying attention to such things and &quot;playing by feel&quot; so to speak. This app allows me quickly scan most items directly, lookup those that don't scan, or even add to the database myself/create custom foods/meals and exercise to keep tracking accurate and streamlined.",Donald Alonzo,5,3.5.3(43),admiration
2147,0.002211247,0.007462062,0.990326703,1,MyPlate Calorie Tracker,2020-11-17,,Love this app!!,J Masters,5,3.5.3(43),love
2148,0.172049791,0.638393104,0.189557105,1,MyPlate Calorie Tracker,2020-11-17,,Bamboo,Benjamin Pfaff,5,3.5.3(8),neutral
2149,0.0040216,0.041043684,0.954934716,1,MyPlate Calorie Tracker,2020-11-17,,Works great,Richard Wilson,5,3.5.3(8),admiration
2150,0.003049859,0.044688191,0.952261984,1,MyPlate Calorie Tracker,2020-11-17,,I like it 👌,Flora Rosa,4,3.5.3(43),love
2151,0.157454371,0.303645968,0.53889966,1,MyPlate Calorie Tracker,2020-11-16,,A very good tracking app. Only complaint is that there is no measurement tracker.,Jean Gray,5,3.5.3(43),admiration
2152,0.004443989,0.016784457,0.978771627,1,MyPlate Calorie Tracker,2020-11-16,,"i love this app ive been using it since i was around 65 pounds now im 72 pounds. this app has helped me keep track of my calories so well i cant even explain all the details but what i ca tell you is that anything that you eat it has all the searches such as fried, not fried or things like how many servings/pounds it is. i love this app so you should deffinetly bring this to your attention.",Denim 08,5,3.5.3(8),love
2153,0.122985989,0.21278511,0.664228916,1,MyPlate Calorie Tracker,2020-11-16,,"Awesome App! PROS: I am able to track food, macros, water, weight AND exercise all in one app. It is simple to calculate nutritional info by using barcode scanner, searching for food, OR manually entering info. I love that I can save my own recipes and foods for easy add later on. CONS: I really wish they had an option to toggle between total/ net carbs in the calculations. I hate seeing my carb intake go into the red zone when I've been so good. Its has some glitches.",E Nicholson,5,3.5.3(36),admiration
2154,0.00157287,0.03151805,0.966909051,1,MyPlate Calorie Tracker,2020-11-16,,Been a my plate member for years. It's my favorite tracking app.,Pam Bradford,5,3.5.3(8),love
2155,0.001564823,0.015894765,0.982540429,1,MyPlate Calorie Tracker,2020-11-16,,This app is so good in calculating your calories consumed everyday ... I recommebd it to everyone,JEMIMA MENSAH,5,3.5.3(8),admiration
2156,0.001555606,0.012266212,0.98617816,1,MyPlate Calorie Tracker,2020-11-15,,I'm glad they updated the app on include drinks. Great app,Madalyn Pfeil,5,,admiration
2157,0.010759875,0.288437039,0.700803101,1,MyPlate Calorie Tracker,2020-11-15,,Lot of options keeps me motivated and dirt under control,Marzuq Noman,4,,neutral
2158,0.035780404,0.144136161,0.820083439,1,MyPlate Calorie Tracker,2020-11-15,,"I love tracking my food. It shows me how high my intake of cholesterol and fat was, I changed a few brands, started paying attention, I'm down 5 inches!!",Amy Sue (Eggy Pop),5,3.5.3(8),love
2159,0.003036087,0.053190652,0.94377327,1,MyPlate Calorie Tracker,2020-11-14,,This connects to my my Samsung health and pulls in my exercise.... BEST.... FOOD TRACKING..... APP...... EVER!!!!!!,Bear,5,3.5.3(8),admiration
2160,0.010335097,0.153368607,0.83629632,1,MyPlate Calorie Tracker,2020-11-14,,Very good ap to track your calorie intake and efficient service on any problems,Amna Niaz,5,3.5.3(8),admiration
2161,0.935858727,0.058053713,0.00608753,0,MyPlate Calorie Tracker,2020-11-13,,"I have been trying to upload a picture to my profile for several days now, on my phone and my tablet. The app crashes every single time. Going to the Livestrong website doesn't help either - the same crash occurs. Please fix ASAP.",Kathleen Lemanski,2,3.5.3(43),annoyance
2162,0.039423622,0.259718955,0.700857401,1,MyPlate Calorie Tracker,2020-11-13,,"This app is very useful to track your nutrients intake. Also as it allows to connect with exercise app such that google fit, user can compare calories intake and calories burnt. However, one drawback is that there is no option to enter food portions in grams.",Lakmal Seneviratne,4,3.5.3(8),neutral
2163,0.090108357,0.139173821,0.7707178,1,MyPlate Calorie Tracker,2020-11-12,,"I absolutely loved this app, ive tried so many and this is the only one that did what i want. I tried adding another food and it said food not found, i tried foods i knew they had and it still didn't show up. I uninstalled the add and downloaded it again and it said the server was down. Please fix this, i loved this app so much ----☆Update☆: after a little time it started working again so yay but please try to find out what happened so this doesn't happen again",Is Me,3,3.5.3(8),love
2164,0.862719655,0.117452227,0.019828107,0,MyPlate Calorie Tracker,2020-11-12,,"Seriously? Cannot switch apps to view caloric data from, let's say, a google search for a specific item that's not listed in MyPlate? When I do so, the tab where I was entering data (calories, macros etc.) just goes back to the &quot;Create food&quot; tab. This is ridiculous, I never had issues with this in other apps. This quite frankly makes it impossible for me to enter all the data I found on Google unless I have to write it down or memorize it. Please fix this ASAP!",Mertcan Ozbek,2,3.5.3(8),annoyance
2165,0.004187325,0.165243894,0.830568731,1,MyPlate Calorie Tracker,2020-11-10,,"I started using this app on mid March and by mid October, I had lost a total of 13 pounds. It calculates the amount of calories you should consume based on your weight and height. It has a catalogue of foods and exercises with their calories, and it also allows you to add your own. You add the food you've eaten during the day and the exercise done. Certainly, it has been a useful tool during my weight loss journey.",Cat M. Gaviota,4,3.5.3(8),approval
2166,0.001733644,0.016671725,0.981594682,1,MyPlate Calorie Tracker,2020-11-09,,Very helpful and easy to use. The baroda scanner is great as well.,Robin Snider,5,3.5.3(8),admiration
2167,0.065153636,0.16180636,0.773039997,1,MyPlate Calorie Tracker,2020-11-09,,"Mostly good but frustrating at times when the exact food I'm looking at has a different calorie and/or carb count on this site than what's on the package. Some as much as 10 grams off so I don't trust it's accuracy and have to also keep a food journal so use them both to get closer to the real thing. Now that I know how to fix this (see comment in response to this), I have to change rating to 5 stars. I've tried other apps and don't like any others as well as this. It's easy and covers everything, including Macros that I can change at will. I love the progress chart too. Once they get some of the inconsistencies corrected it will be perfect, but it's already great, definitely worth using, especially now that I know how to help in that area. I would recommend this site.",Cindi Allen,5,3.5.3(36),admiration
2168,0.00194677,0.016056424,0.981996834,1,MyPlate Calorie Tracker,2020-11-09,,So far so good!,William Davidson,5,3.5.3(8),joy
2169,0.847277999,0.138016239,0.014705768,0,MyPlate Calorie Tracker,2020-11-09,,"Was happy with it, but now I'm unable to open it. It keeps closing on me.",Melissa Mason,1,3.5.3(36),joy
2170,0.003179576,0.018774467,0.97804594,1,MyPlate Calorie Tracker,2020-11-09,,Love it- no issues!,Maribeth Kingsbury (MB),5,3.5.3(8),love
2171,0.001622775,0.028539231,0.969838023,1,MyPlate Calorie Tracker,2020-11-09,,This app is easy to use and very helpful if you are trying to lose weight!,Juliana Peters,4,,approval
2172,0.841327667,0.145142838,0.013529421,0,MyPlate Calorie Tracker,2020-11-08,,"I ended deleting the app after 5 minutes because when I was signing up, no matter what I put in for the username it was &quot;invalid&quot;. I tried every username I think of from the description my username had to be and plus it too much just for a just for a username.",Sarah Morten,1,3.5.3(8),realization
2173,0.960409462,0.035463404,0.004127087,0,MyPlate Calorie Tracker,2020-11-08,,The app no longer lets me delete or edit entries so I can't change the serving amount. It also doesn't let me add it multiple times if you were wondering. Basically the app is completely useless.,Adley Sketches,1,3.5.3(8),annoyance
2174,0.859886765,0.121694587,0.018418645,0,MyPlate Calorie Tracker,2020-11-08,,"If you find a good item to track calories today you may not be able to find it tomorrow. I've never seen an app do that function so poorly. You literally cannot get to a stored food item by name. You type it in and the results suddenly do not have the item anymore. Then magically, a week later, you might find it again. Pretty poor development tbh.",T R,2,3.5.3(8),disappointment
2175,0.002256211,0.067709371,0.930034399,1,MyPlate Calorie Tracker,2020-11-07,,Really helps keep track of calories and is encouraging to eat better,Blake Ward,5,3.5.3(8),caring
2176,0.060793415,0.329427898,0.609778702,1,MyPlate Calorie Tracker,2020-11-06,,Good,Osvaldo Sanchez,5,3.5.3(8),admiration
2177,0.927129984,0.066414677,0.006455448,0,MyPlate Calorie Tracker,2020-11-05,,"Used app before, forgot password, followed prompt for new one, never accepted new one. Couldn't even get started 😡!!! How can I log in???",Julie Kuchek,1,,confusion
2178,0.042230837,0.876332343,0.08143682,1,MyPlate Calorie Tracker,2020-11-04,,Like the way you can track all your meals during the day,Daniel Austria,5,3.5.3(8),neutral
2179,0.005027012,0.025110034,0.969862998,1,MyPlate Calorie Tracker,2020-11-04,,loving this app,Rejeane Ritter,4,3.5.3(8),love
2180,0.00118016,0.031268839,0.967550993,1,MyPlate Calorie Tracker,2020-11-04,,Pretty easy & has already encouraged me to stay active with tracking !!!,Patricia Fimbres,5,3.5.3(8),caring
2181,0.002656706,0.025218356,0.972124934,1,MyPlate Calorie Tracker,2020-11-04,,So far so good,Sumyt Kumar,5,3.5.3(8),joy
2182,0.00248296,0.028899036,0.968618035,1,MyPlate Calorie Tracker,2020-11-04,,Very convenient!!,Bud Slife,5,3.5.3(8),approval
2183,0.003344875,0.051213022,0.94544208,1,MyPlate Calorie Tracker,2020-11-04,,So far it's fine😊,Eleanor Smith,5,3.5.3(8),approval
2184,0.002972085,0.022028217,0.974999726,1,MyPlate Calorie Tracker,2020-11-04,,Great product lots of information and easy to use,A Google user,5,3.5.3(8),admiration
2185,0.825719774,0.162173986,0.012106249,0,MyPlate Calorie Tracker,2020-11-03,,"Can't add photo to my profile. I choose the photo, crop it, tap on the checkmark and nothing happens. Am I doing something wrong?",XG CM,3,3.5.3(8),confusion
2186,0.109920062,0.383481681,0.506598234,1,MyPlate Calorie Tracker,2020-11-03,,"Easy to use, like the option for reminders and the breakdown for macros. Would like to see the meals grouped instead of by ingredients; it's hard to change the portion of meal/delete a meal entry if you've made a mistake. Secondary reminders for water consumption would also be awesome to have. From what I've seen, there is somewhat minimal integration for inputting exercises but I don't have a wearable tracking Cal's/exercise.",Lily Chau,4,3.5.3(8),approval
2187,0.033833228,0.267107487,0.699059308,1,MyPlate Calorie Tracker,2020-11-03,,Great,Helen Zille,5,3.5.3(8),admiration
2188,0.009711274,0.226194799,0.764093935,1,MyPlate Calorie Tracker,2020-11-02,,"Simple, lightweight app that does it's job. S/o on the barscanning feature",Anirudh Ryali,5,3.5.3(8),neutral
2189,0.002710794,0.014432122,0.982857108,1,MyPlate Calorie Tracker,2020-11-01,,"I've had no trouble with this app, love the reminders, considering upgrading with my new program",Ma Roo,5,3.5.3(8),approval
2190,0.00441001,0.036167093,0.959422946,1,MyPlate Calorie Tracker,2020-11-01,,It's amazing,jjk btw,5,3.5.3(8),admiration
2191,0.009352851,0.062779993,0.927867174,1,MyPlate Calorie Tracker,2020-10-31,,I love the way you can adjust servings,Robin Atkinson,5,3.5.3(8),love
2192,0.962970138,0.033211831,0.003818063,0,MyPlate Calorie Tracker,2020-10-29,,This app is not user-friendly,Chris Jodoin,1,3.5.3(8),disapproval
2193,0.003844613,0.044137098,0.952018261,1,MyPlate Calorie Tracker,2020-10-29,,Very easy to use. Made it easy to keep up with everything all in one place.,Thelma Carlton,4,3.5.3(8),neutral
2194,0.003650844,0.038788486,0.957560718,1,MyPlate Calorie Tracker,2020-10-29,,A very helpful app.,Debra Bolinger,4,3.5.3(8),approval
2195,0.004030176,0.02792182,0.968047976,1,MyPlate Calorie Tracker,2020-10-29,,Love the barcode scanner too.....and easy to use.,Suzanne Bruce,5,3.5.3(8),love
2196,0.017131509,0.222533196,0.760335267,1,MyPlate Calorie Tracker,2020-10-28,,Easy to use.,Linda Pomeroy,5,3.5.3(8),neutral
2197,0.094915934,0.682389319,0.222694755,1,MyPlate Calorie Tracker,2020-10-28,,Very resourcefsul,Ángel Miguel “Guelo” Nuñez Cruz,5,3.5.3(8),neutral
2198,0.003134984,0.06013428,0.936730683,1,MyPlate Calorie Tracker,2020-10-28,,Cool app,Kathleen McEvoy,5,3.5.2(8),admiration
2199,0.010962408,0.110262468,0.87877512,1,MyPlate Calorie Tracker,2020-10-27,,I like it,Tabitha Davis,5,3.5.3(8),love
2200,0.073142722,0.780899465,0.145957768,1,MyPlate Calorie Tracker,2020-10-26,,KEEPS ME TRACK,Sonia Cruz,5,3.5.3(8),neutral
2201,0.004032917,0.045627054,0.950340033,1,MyPlate Calorie Tracker,2020-10-25,,Great app! Overall does everything someone needs to track calories.,eric mckenzie,5,3.5.3(8),admiration
2202,0.004661723,0.02029402,0.97504425,1,MyPlate Calorie Tracker,2020-10-25,,Was looking for an app that I could put n find all my food calories n MY PLATE HAS IT ALL I LOVE THIS APP,Shena Crawford,5,3.5.3(8),desire
2203,0.006211912,0.032733709,0.961054325,1,MyPlate Calorie Tracker,2020-10-25,,"Very handy app. I use it everyday to track calories and nutrients. Would really, really like to see the option to use NET CARBS as the daily total carbs. That would be very useful to me. Love, love, love the bar-code scanning feature. I think some sort of organizational options for MY FOODS would also be helpful (folders? groups? sorting?) Scrolling through an unordered list of many items is pretty laborious. Overall, it's a very valuable tool to me.",Jason Herbert,4,3.5.3(8),approval
2204,0.005356545,0.169178069,0.825465381,1,MyPlate Calorie Tracker,2020-10-23,,Easy to use and follow. Purchase to get better access to healthy advice.,Petar Gatic,5,3.5.3(8),approval
2205,0.123717047,0.522091031,0.354191989,1,MyPlate Calorie Tracker,2020-10-23,,Quite useful tool on keeping track calories. But why egg boiled (soft or hard) has zero protein content in the daily value %? Stated as 100% carb.,Liew YC,3,3.5.3(8),neutral
2206,0.149710402,0.256385952,0.593903601,1,MyPlate Calorie Tracker,2020-10-23,,I have used this app for three years now and have loved it but one thing that is getting old for me is that the &quot;My Food&quot; Tab is in random order it takes for ever for me to find a food I have already entered. If it were in alphabetical order this app would be perfect.,Uriel Steen,2,,love
2207,0.006088829,0.048529763,0.945381343,1,MyPlate Calorie Tracker,2020-10-23,,Loved this app it shows correct calories count and it has information about almost all food that i eat.,Ankit Mishra,4,3.5.3(8),love
2208,0.001142933,0.014839569,0.984017432,1,MyPlate Calorie Tracker,2020-10-22,,"Day one for me. I really like it. I'm tracking what I eat with the calorie counter, and am looking forward to more conscious eating.",Stacey Owens-Jolley,5,3.5.3(8),approval
2209,0.004682379,0.06733083,0.927986801,1,MyPlate Calorie Tracker,2020-10-22,,Very easy to use,Amy Maxwell,4,3.5.3(8),approval
2210,0.005679077,0.079243533,0.915077388,1,MyPlate Calorie Tracker,2020-10-22,,It's good to use,Avawsom3 Vlogs,5,3.5.3(8),approval
2211,0.013914184,0.067865185,0.91822058,1,MyPlate Calorie Tracker,2020-10-22,,"Pretty good app like how it's setup and would be higher and my favorite, but it's missing net carbs after fiber and alcohol sugar is subtracted and wish it had were you can edit foods nutrition. Overall not bad though looking forward to any new features.",Brian Laughren,4,3.5.3(8),admiration
2212,0.003287865,0.016822843,0.979889333,1,MyPlate Calorie Tracker,2020-10-22,,Love it so far,Nancy Remp,5,3.5.3(8),love
2213,0.002575218,0.056505732,0.940919101,1,MyPlate Calorie Tracker,2020-10-21,,Seem to be doing well. First day using it.,Vickie Stafford,4,3.5.3(8),optimism
2214,0.00198139,0.014849447,0.983169198,1,MyPlate Calorie Tracker,2020-10-21,,Works really good,Brittany Brandt,5,3.5.3(8),admiration
2215,0.197416514,0.644111097,0.158472419,0,MyPlate Calorie Tracker,2020-10-21,,Food,Kasarachi Ezeakolam,5,3.5.3(8),neutral
2216,0.003197089,0.015890038,0.980912864,1,MyPlate Calorie Tracker,2020-10-21,,Great! Love the barcode scanner!,Jackie Ripper,5,3.5.3(8),admiration
2217,0.004280982,0.124251105,0.871467888,1,MyPlate Calorie Tracker,2020-10-21,,"I tested 30 apps this one was the very easiest for me to track daily carbs, fiber, saturated fats and fiber essential for a low carb diet.",J Morris,5,3.5.3(8),neutral
2218,0.837643147,0.151468903,0.010887959,0,MyPlate Calorie Tracker,2020-10-21,,When I opened this app it was showing no internet connection. Don't know what happened,Alwina Saji,2,3.5.3(8),confusion
2219,0.022370202,0.290749788,0.686880052,1,MyPlate Calorie Tracker,2020-10-20,,Good aap but paid,Abban Raza,5,3.5.3(8),admiration
2220,0.001547238,0.012133839,0.986318946,1,MyPlate Calorie Tracker,2020-10-20,,It's a very interesting app!,carla duarte,5,3.5.3(8),excitement
2221,0.001921806,0.044552084,0.953526139,1,MyPlate Calorie Tracker,2020-10-20,,It helps me eat so much healthier,Sheena Faith,5,3.5.3(8),neutral
2222,0.029329518,0.319544852,0.651125669,1,MyPlate Calorie Tracker,2020-10-20,,"easier to use than weight watchers, and the free version is, well, free !",Raymond 7779,5,3.5.3(8),approval
2223,0.001677806,0.025705572,0.972616613,1,MyPlate Calorie Tracker,2020-10-19,,Its really helping me to learn how to keep track of my calories better best app I've had so far,Edmund Hyson,5,3.5.3(8),realization
2224,0.002699219,0.019373232,0.977927566,1,MyPlate Calorie Tracker,2020-10-19,,Great app!,Claudia Arrunategui,5,3.5.3(8),admiration
2225,0.011840117,0.169526324,0.818633616,1,MyPlate Calorie Tracker,2020-10-19,,Very easy to use... Tracks all your food and exercise... I wish it allowed you to set your personal macro goals. Not everyone is using the traditional daily allowances.,Jim Doyle,5,3.5.3(8),desire
2226,0.08852189,0.609052837,0.302425295,1,MyPlate Calorie Tracker,2020-10-18,,BEST APP,Stevie Collins,5,3.5.3(8),neutral
2227,0.001524803,0.009147075,0.989328086,1,MyPlate Calorie Tracker,2020-10-18,,Love it! Makes eating healthy easy!,Shannon Galbraith,5,3.5.3(8),love
2228,0.001248019,0.012121701,0.986630321,1,MyPlate Calorie Tracker,2020-10-18,,I love this app tracks everything you do so you are assured your making real progress!,G Iverson,5,3.5.3(8),love
2229,0.002370125,0.027610911,0.970018983,1,MyPlate Calorie Tracker,2020-10-17,,"Just started, but so far seems good",michele holloway,5,3.5.3(8),optimism
2230,0.002362451,0.029194281,0.968443274,1,MyPlate Calorie Tracker,2020-10-17,,Good so far!,dawn wright,5,3.5.3(8),optimism
2231,0.00627648,0.16786091,0.825862646,1,MyPlate Calorie Tracker,2020-10-17,,Easy to use with an extensive database.,L Fontana,4,3.5.3(8),approval
2232,0.003183145,0.016290652,0.980526268,1,MyPlate Calorie Tracker,2020-10-17,,So far I love it.,Madina Rona,5,3.5.3(8),love
2233,0.015412518,0.0752002,0.909387231,1,MyPlate Calorie Tracker,2020-10-15,,Easy to use and it is not covered in ads. Best I have tried so far.,Peter-Donnell Boynton,5,3.5.3(8),approval
2234,0.00833755,0.083822198,0.907840252,1,MyPlate Calorie Tracker,2020-10-15,,Awesome,Michael Daum,5,3.5.3(8),admiration
2235,0.217832491,0.53150481,0.250662684,1,MyPlate Calorie Tracker,2020-10-15,,I like that you can add each ingredient from a recipe but if the recipe serves eight and I select my portion size as .13 why does it take some ingredients at .65 and others at .26. The numbers are all over the place. They should all be .13 but they aren't.,Sonia Burrows,3,3.5.3(8),confusion
2236,0.17513679,0.420779288,0.404083937,1,MyPlate Calorie Tracker,2020-10-15,,It is good but a little confusing,Michael Schmidt,4,3.5.3(8),confusion
2237,0.026498297,0.834071577,0.13943021,1,MyPlate Calorie Tracker,2020-10-14,,Is this app free?,Daniel Turner,3,3.5.3(8),curiosity
2238,0.010141123,0.163159296,0.826699555,1,MyPlate Calorie Tracker,2020-10-14,,It makes my dieting easy,Brianna Crabtree,5,3.5.3(8),neutral
2239,0.003859545,0.060324397,0.93581599,1,MyPlate Calorie Tracker,2020-10-14,,Lots of good options to choose from,Ann Holmes,4,3.5.3(8),approval
2240,0.014571379,0.064902581,0.920526028,1,MyPlate Calorie Tracker,2020-10-13,,Love it,Justin Sullender,5,3.5.3(8),love
2241,0.003947854,0.052000329,0.944051743,1,MyPlate Calorie Tracker,2020-10-13,,Amazing so far,Aug,5,3.5.3(8),admiration
2242,0.592336357,0.387461007,0.020202693,0,MyPlate Calorie Tracker,2020-10-13,,I try to sign it it just says no internet connection,Mᗅᝣ,2,3.5.3(8),neutral
2243,0.002764062,0.022642795,0.974593163,1,MyPlate Calorie Tracker,2020-10-13,,Easy to use. Thank you,Lu Lilac,5,3.5.3(8),gratitude
2244,0.005273817,0.042851761,0.951874495,1,MyPlate Calorie Tracker,2020-10-12,,Very good,altamashikhlaq Kazi,5,3.5.3(8),admiration
2245,0.001937871,0.013890733,0.98417145,1,MyPlate Calorie Tracker,2020-10-12,,Have loved this app since I downloaded it in 2010 for my husband after his cancer surgery to track his input. Really easy to use and so helpful.,Kate Bauer,5,3.5.3(8),love
2246,0.00176969,0.012026865,0.986203432,1,MyPlate Calorie Tracker,2020-10-12,,So far this thing is great.,Patrick English,5,3.5.3(8),admiration
2247,0.014571379,0.064902581,0.920526028,1,MyPlate Calorie Tracker,2020-10-11,,Love it,Blue Lightning,1,3.2.0(0),love
2248,0.002958454,0.03268167,0.964359879,1,MyPlate Calorie Tracker,2020-10-11,,Great app for what I need.,Topaz Alexandria,5,3.5.3(8),admiration
2249,0.032686532,0.592455089,0.374858379,1,MyPlate Calorie Tracker,2020-10-11,,I've used many different food tracking apps. I always come back to this one.,Linda Kenney,5,3.5.3(8),neutral
