Id,roberta_neg,roberta_neu,roberta_pos,roberta_polarity,Source,Date,Title,Content,Name,Rating,Version,emotion
1507,0.001960864,0.021084948,0.976954162,1,MyPlate Calorie Tracker,2021-05-04,,This app is very good. I find a lot of foods already in here. It makes it very simple to track my calories.,Jim Johnson,5,3.5.3(59),admiration
1508,0.002425515,0.0215765,0.975997984,1,MyPlate Calorie Tracker,2021-05-04,,"Love this app for tracking food that I've eaten. I'm trying to balance my diet, and this app is perfect for helping with that. Plus, there's the extra perk of getting to converse with those in the same shoes as I so to speak. It's good to know I'm not alone in this fight to stay healthy.",Sharla Miles,5,3.5.3(59),love
1509,0.017131509,0.222533196,0.760335267,1,MyPlate Calorie Tracker,2021-05-04,,Easy to use.,Jennifer Beall,5,3.5.3(59),neutral
1510,0.003193382,0.021921918,0.974884689,1,MyPlate Calorie Tracker,2021-05-04,,It was a great experience but while clicking on any chat in community tab the app automatically closes .. yet giving it 4 stars as it is very easy to use and highly functioning.,Khushi Garg,4,,admiration
1511,0.003017662,0.081888713,0.915093601,1,MyPlate Calorie Tracker,2021-05-03,,"Easy to use, simple yet informative layout.",Lance Sherwood,5,3.5.3(59),neutral
1512,0.005864736,0.058364574,0.93577069,1,MyPlate Calorie Tracker,2021-05-03,,It works great,Kerri Steward,4,3.5.3(59),admiration
1513,0.601811588,0.368693262,0.029495195,0,MyPlate Calorie Tracker,2021-05-03,,Adding meals was confusing,john jaeger,4,3.5.3(59),confusion
1514,0.125157878,0.486176401,0.388665736,1,MyPlate Calorie Tracker,2021-05-02,,Gud,NAMITHA CHANDRAN,3,3.5.3(59),neutral
1515,0.005701892,0.134866372,0.859431744,1,MyPlate Calorie Tracker,2021-05-02,,Brilliant... Helped me lose 40kg and keep It off.,Louise Smit,5,3.5.3(59),admiration
1516,0.112962328,0.364483535,0.5225541,1,MyPlate Calorie Tracker,2021-05-02,,"Makes it easy to watch what your eating, I've lost 40 pounds since I started using this app. Amazing how the calories can pile up when you're not aware of how many are in the foods we eat.",John Monty,5,3.5.3(59),surprise
1517,0.001553278,0.024504751,0.973941982,1,MyPlate Calorie Tracker,2021-05-02,,Only just started but feeling good about this app.,Sue,5,3.5.3(59),joy
1518,0.002068419,0.008136507,0.989795029,1,MyPlate Calorie Tracker,2021-05-02,,Love this app!,Kathy Wentz,5,3.5.3(59),love
1519,0.099855766,0.266576886,0.633567333,1,MyPlate Calorie Tracker,2021-05-02,,"I like the website better than the app, I can't always find what I'm looking for on the app.",vernon nunemaker,4,3.5.3(59),love
1520,0.004095879,0.129754394,0.866149724,1,MyPlate Calorie Tracker,2021-05-02,,Easy to use and worth referring people to,Jul Davis,5,3.5.3(59),approval
1521,0.003994821,0.123004876,0.873000324,1,MyPlate Calorie Tracker,2021-05-02,,This app makes it really simple to track your calories and has many different plans to do so,Caleb,5,3.5.3(59),neutral
1522,0.012952211,0.188341707,0.798706114,1,MyPlate Calorie Tracker,2021-05-02,,"Easy to use once you figure it out. Lost 15 lbs in 3 months but had to religiously enter all foods, drinks, condiments to make the magic happen.",Dawn Shea,5,3.5.3(59),neutral
1523,0.495592088,0.309613764,0.194794133,0,MyPlate Calorie Tracker,2021-05-02,,"Great app, and run by people who seem to actually care, and who motivate without being patronising. Unfortunately the scanner doesn't work for me, which is disappointing. Otherwise it would be 5 stars.",Natascha Kay,4,3.5.3(59),disappointment
1524,0.002656706,0.025218356,0.972124934,1,MyPlate Calorie Tracker,2021-05-02,,So far so good,Sue Young,5,3.5.3(59),joy
1525,0.014934164,0.184054554,0.801011264,1,MyPlate Calorie Tracker,2021-05-02,,Easy to use,Melanie Allison,5,3.5.3(59),neutral
1526,0.014934164,0.184054554,0.801011264,1,MyPlate Calorie Tracker,2021-05-02,,Easy to use,Mykie NMSM,5,3.5.3(59),neutral
1527,0.001888365,0.031311575,0.966800034,1,MyPlate Calorie Tracker,2021-05-02,,Really helpful and simple,kyle stevens,5,3.5.3(59),optimism
1528,0.002563912,0.108462177,0.888973832,1,MyPlate Calorie Tracker,2021-05-01,,Definitely helps me keep on track,Carolyn Henry,5,3.5.3(59),excitement
1529,0.002723692,0.018529488,0.978746831,1,MyPlate Calorie Tracker,2021-05-01,,New to the app but lovimg it so far,Mark T,5,3.5.3(59),love
1530,0.007265379,0.114068322,0.878666341,1,MyPlate Calorie Tracker,2021-05-01,,"Been using MyPlate for years. Easy to use, easy to find food with search. Easy to add my food.",Debra Sasser,5,3.5.3(59),neutral
1531,0.003337817,0.040460963,0.956201196,1,MyPlate Calorie Tracker,2021-05-01,,"Great help,lost five pounds instantly that was a wow.",Pamela Bolin,5,3.5.3(59),admiration
1532,0.05458039,0.357447654,0.587971985,1,MyPlate Calorie Tracker,2021-05-01,,Pretty good for keeping track but sometimes you can't find a food or it's miscalculated but it gives you a good idea of where you're at.,Kimberly McDaniel,4,,approval
1533,0.055719104,0.243960276,0.700320601,1,MyPlate Calorie Tracker,2021-05-01,,Love that I can scan barcodes. The only thing I wish is that I could pull recipes from online and your app would decipher how many calories it is.,Rose's Garden,5,3.5.3(59),desire
1534,0.001987399,0.014722184,0.983290434,1,MyPlate Calorie Tracker,2021-05-01,,Great app for tracking my calories. I like that my google fit data feeds into the app. I also like how easy it is to input my meals. The weekly summary email is helpful as well!,Lisa Parmelee,5,3.5.3(59),admiration
1535,0.003306173,0.033319607,0.963374197,1,MyPlate Calorie Tracker,2021-05-01,,I really like the app just need to add more options of food. We also use the metric system,Ajay Singh,5,,approval
1536,0.002561088,0.009723319,0.987715542,1,MyPlate Calorie Tracker,2021-05-01,,This app. is great. Easy to use.,Carolyn Calhoun,5,3.5.3(59),admiration
1537,0.002444037,0.110664666,0.886891305,1,MyPlate Calorie Tracker,2021-05-01,,Apps like this one encourage me to restart a balanced lifestyle.,Jorrid Giesbrecht,4,3.5.3(59),joy
1538,0.012005519,0.08470998,0.90328449,1,MyPlate Calorie Tracker,2021-05-01,,Nice app,Niharika singh,5,3.5.3(59),admiration
1539,0.012429339,0.16534695,0.822223663,1,MyPlate Calorie Tracker,2021-04-30,,Great efficient,James Walsh,5,3.5.3(59),admiration
1540,0.002800329,0.142741799,0.854457915,1,MyPlate Calorie Tracker,2021-04-30,,Definitely helps with weight loss and tracking!,Kodi Clayton,5,3.5.3(59),caring
1541,0.060793415,0.329427898,0.609778702,1,MyPlate Calorie Tracker,2021-04-30,,Good,Tina Reynolds,5,3.5.3(59),admiration
1542,0.046555825,0.716618419,0.236825705,1,MyPlate Calorie Tracker,2021-04-30,,Use it everyday,Steve Stange,5,3.5.3(59),neutral
1543,0.001186253,0.02640293,0.972410858,1,MyPlate Calorie Tracker,2021-04-30,,Great app that helps me keep on track with my weight loss journey in terms of tracking macros.,kim Moreland,5,3.5.3(59),admiration
1544,0.005172183,0.066514865,0.928312957,1,MyPlate Calorie Tracker,2021-04-30,,"Works great. Scanner of items for nutrition info makes things quick, but the search function is easy to use as well. Tracks activity (steps) from GoogleFit too ,which is a plus, but not manually entered activity in Fit, so I have to do double entry. Wish it had a recipe nutritional calculator built in or could connect to a recipe calculator as I make many homemade recipes. Just by tracking calories for a month, I've lost 12 lbs.",Jarrod Chance,4,3.5.3(59),admiration
1545,0.002569613,0.041111335,0.956319034,1,MyPlate Calorie Tracker,2021-04-30,,Very helpful!,McKitty Johnson,5,3.5.3(59),approval
1546,0.006987671,0.171804637,0.821207702,1,MyPlate Calorie Tracker,2021-04-30,,Easy to use. It's been useful to keep track of what I eat.,Will,5,3.5.3(59),neutral
1547,0.055351198,0.628420711,0.316228181,1,MyPlate Calorie Tracker,2021-04-30,,User- friendly,Jamie Prater,4,3.5.3(59),neutral
1548,0.00719087,0.624220073,0.368589073,1,MyPlate Calorie Tracker,2021-04-29,,Tracks calories and macros to help with weight control the right way.,Ray Mauk,5,3.5.3(59),neutral
1549,0.0215599,0.113828018,0.864612043,1,MyPlate Calorie Tracker,2021-04-29,,"Very basic, good, non gendered app. I used it to gain weight. It was hard to find an app not catered to only one gender and mainly aimed at losing weight. Could use more free features and cheaper pay options, but it's very good for the basics i needed",Jordan Roy,5,3.5.3(59),approval
1550,0.0025584,0.072399303,0.925042272,1,MyPlate Calorie Tracker,2021-04-29,,I have lost 50 pounds while using this app. Counting calories and exercise have been my ticket to better health.,H Pomales,5,3.5.3(59),neutral
1551,0.003653215,0.078436948,0.917909801,1,MyPlate Calorie Tracker,2021-04-29,,Easy to use. Finds most of the foods. Been using the free version for a couple months and so far no issues.,Malcolm Cook,4,3.5.3(59),approval
1552,0.007617312,0.052869566,0.939513087,1,MyPlate Calorie Tracker,2021-04-29,,Love tracking my meals and eady to add my own things and common meals for me. An improvement i would love to see is beibg able to enter exact amounts of water i drink as it only seems to go by 8 ounces. I often drink 6 or 16.9 water bottle. 😊 thanks,Bavonnie C,4,3.5.3(59),gratitude
1553,0.002233152,0.00900382,0.988763034,1,MyPlate Calorie Tracker,2021-04-29,,I love this app. Easy to use and I can add my Nigerian foods. Fantastic,Chidinma OKoye,5,3.5.3(59),admiration
1554,0.001604919,0.011155381,0.987239659,1,MyPlate Calorie Tracker,2021-04-28,,This is the best ever app for calories tracking thanks.,zackaria sawadogo,5,3.5.3(54),gratitude
1555,0.014571379,0.064902581,0.920526028,1,MyPlate Calorie Tracker,2021-04-28,,Love it,Sue Edwards,4,3.5.3(59),love
1556,0.014934164,0.184054554,0.801011264,1,MyPlate Calorie Tracker,2021-04-28,,Easy to use,M Lenny,5,3.5.3(59),neutral
1557,0.002747247,0.033715423,0.963537335,1,MyPlate Calorie Tracker,2021-04-28,,So easy to use!,Monica Brunner,5,3.5.3(59),approval
1558,0.001829871,0.036598731,0.961571336,1,MyPlate Calorie Tracker,2021-04-28,,Macro tracker and goal settings are very useful!,Kristophe Barleben,5,3.5.3(59),neutral
1559,0.00426234,0.038348675,0.957388997,1,MyPlate Calorie Tracker,2021-04-28,,Good app. Easy to use and has what is need.,Robert Wood,5,3.5.3(59),admiration
1560,0.004929286,0.063666672,0.931404114,1,MyPlate Calorie Tracker,2021-04-28,,Very good food database,Alex B,5,3.5.3(59),admiration
1561,0.801084399,0.187109411,0.011806302,0,MyPlate Calorie Tracker,2021-04-28,,"Could not reset password, had to install a different app",Lisa G,1,3.5.3(59),neutral
1562,0.010270242,0.055955123,0.93377459,1,MyPlate Calorie Tracker,2021-04-28,,Works well! Easy to use and has made me aware of how many calories I was eating from bad food choices. In a little over 2 months I have lost 9lbs and 1 inch from my waist by simply eating better. I recommend!,Travis Slidell,4,3.5.3(59),realization
1563,0.014148165,0.272753775,0.713098049,1,MyPlate Calorie Tracker,2021-04-28,,Easy to use to track my eating habits. My attempt is to see the things I am eating and hopefully find healthier options. Good community to have other people's opinions on the same subject.,Meranda Dennis,5,3.5.3(59),optimism
1564,0.003104451,0.012916075,0.983979464,1,MyPlate Calorie Tracker,2021-04-28,,Love it! So simple,Chelsea Carter,5,3.5.3(54),love
1565,0.006538281,0.096289799,0.897171974,1,MyPlate Calorie Tracker,2021-04-27,,😘😍,Angelica De Leon,4,3.5.3(54),sadness
1566,0.276384115,0.581465542,0.142150342,0,MyPlate Calorie Tracker,2021-04-27,,Having trouble changing water size from 8 onces to 16 ounce size. And other quantity size changes. All else is fine.,Daniel Kellner,5,3.5.3(59),approval
1567,0.168245882,0.480158776,0.351595342,1,MyPlate Calorie Tracker,2021-04-27,,Excellent,Judith Brown,5,3.5.3(59),admiration
1568,0.308175296,0.590430021,0.101394698,0,MyPlate Calorie Tracker,2021-04-27,,"Sometimes the database data on nutrients is not matching the tag on the product. Wish there was a way to edit the nutrients data when and after adding. Also, wish there was a way to express the quantity in arbitrary units, as opposed to the proportion of the fixed serving sizes. Finally, wish there were a way to import burned calories directly from FitBit.",Bakhtiyar Neyman,4,,desire
1569,0.002025977,0.020364363,0.977609634,1,MyPlate Calorie Tracker,2021-04-27,,Great for being free!,Amy Buckley,5,3.5.3(59),excitement
1570,0.001844823,0.014549345,0.983605862,1,MyPlate Calorie Tracker,2021-04-27,,"I really love that not only can I track my calories through this app, but it also alllows me to track my water and steps. Love that it connects to my Google fit too.",Irene Leffew,5,3.5.3(59),love
1571,0.029270934,0.385022521,0.585706592,1,MyPlate Calorie Tracker,2021-04-27,,👍,Sandi Phillips,5,3.5.3(59),curiosity
1572,0.009610774,0.269082993,0.721306264,1,MyPlate Calorie Tracker,2021-04-27,,I like that you can scan what you eat as well as track your water.,Constance Sharpe,5,3.5.3(59),love
1573,0.002027749,0.02589122,0.972081006,1,MyPlate Calorie Tracker,2021-04-27,,Pretty comprehensive and easy-to-use app,Gene Smith,5,3.5.3(54),admiration
1574,0.002095158,0.018317545,0.979587317,1,MyPlate Calorie Tracker,2021-04-27,,This is a great app for calorie counting. Great barcode scanner!,Julie Luedtke,5,3.5.3(54),admiration
1575,0.066038191,0.354452819,0.57950896,1,MyPlate Calorie Tracker,2021-04-27,,Nice,Marcia Espinosa-Oliva,5,3.5.3(54),admiration
1576,0.002185649,0.020571653,0.977242649,1,MyPlate Calorie Tracker,2021-04-26,,Great so far!,Amanda,5,3.5.3(54),gratitude
1577,0.006406218,0.069792673,0.923801064,1,MyPlate Calorie Tracker,2021-04-26,,"Very neutral language that doesn't guilt trip. Helps track a bunch of things, including water intake, exercise, weight, macros and micros. I do wish the water tracking was a little more expensive as it only lets you increase how much you drank in 8, 16, & 32 oz. Also has a community for support and questions. One of the best lifestyle trackers I've ever used, and I've been trying for a decade to stay healthy!",Louca Crendell,5,3.5.3(59),admiration
1578,0.002454903,0.012782679,0.98476243,1,MyPlate Calorie Tracker,2021-04-26,,Very nice app and easy to use,Daniel Botero Correa,5,3.5.3(59),admiration
1579,0.014934164,0.184054554,0.801011264,1,MyPlate Calorie Tracker,2021-04-26,,Easy to use,Dawn Lowe,5,3.5.3(59),neutral
1580,0.015263967,0.145584062,0.839151978,1,MyPlate Calorie Tracker,2021-04-26,,Fantastic and accurate,Craig Branson,5,3.5.3(54),admiration
1581,0.012144124,0.109152615,0.878703296,1,MyPlate Calorie Tracker,2021-04-26,,Great App. Wish it let you carry over lunches rather than just breakfasts,Ashlee Smith,5,3.5.3(59),admiration
1582,0.014934164,0.184054554,0.801011264,1,MyPlate Calorie Tracker,2021-04-25,,Easy to use,Eugene Huang,5,3.5.3(54),neutral
1583,0.011148217,0.194885924,0.793965816,1,MyPlate Calorie Tracker,2021-04-25,,totally worthwhile,heather lehman,5,3.5.3(59),joy
1584,0.004013992,0.12770091,0.86828506,1,MyPlate Calorie Tracker,2021-04-25,,Really helps me make sure I get enough protein. That is the key for me to lose weight.,Coral Laster,5,,approval
1585,0.563160002,0.340430081,0.096409954,0,MyPlate Calorie Tracker,2021-04-25,,"Missed Potential - But Serves the Purpose... Lowering my rating from 4 to 3, as the developer/company really isn't adding much needed features, like editing meal names, etc. Such an easy addition, but the lack of it has really ruined the experience for me. A lot of other no-brainsers missing, as well, which come to light after usage. Still, it does what it sets out to do and usually well. That said, will likely start looking for a new tracker soon.",Andrew Hanke,3,3.5.3(54),disappointment
1586,0.002546751,0.038344465,0.95910877,1,MyPlate Calorie Tracker,2021-04-24,,Awesome track everything from water to calories. This has helped me in my weight loss and finding the food I have is rather easy. May be moving up to gold rather soon!!,Ronald Rought,5,3.5.3(59),approval
1587,0.002308555,0.042913422,0.954778016,1,MyPlate Calorie Tracker,2021-04-24,,Best tracking app there is. Most accurate for macros,Vito Abbato,5,3.5.3(59),admiration
1588,0.001155308,0.011870655,0.986974001,1,MyPlate Calorie Tracker,2021-04-24,,"This is a great app, which helps me to keep focused on healthy eating.",Tracy Ponton,5,3.5.3(59),admiration
1589,0.005699025,0.09967763,0.894623399,1,MyPlate Calorie Tracker,2021-04-24,,Excellent... Great way to keep track of food and exercise,Annette M,5,3.5.3(59),admiration
1590,0.649157465,0.313787341,0.037055258,0,MyPlate Calorie Tracker,2021-04-24,,Succsessful,Mica Swanson,5,3.5.3(59),approval
1591,0.001676673,0.041409995,0.956913412,1,MyPlate Calorie Tracker,2021-04-23,,"Started using this app Nov 1, 2018. I weighed 239.8 pounds (5 foot 11). Using it, common sense, walking daily and making better informed choices led me to the 182.4 pounds I am today. Thank you for helping me achieve and sustain my goal for a healthier me.",Dave McIntyre,5,,gratitude
1592,0.976467669,0.020784486,0.002747857,0,MyPlate Calorie Tracker,2021-04-22,,Your App sucks....cant even delete post or photos.....thats kind of creepy.,Cheyenne Rivera,1,,disgust
1593,0.076913767,0.328076094,0.595010161,1,MyPlate Calorie Tracker,2021-04-22,,Very good and useful app but all the foods and ingredients needs to be checked and verified to avoid the incorrect nutrition facts.,Abd Alhakym Mudrek,5,,admiration
1594,0.018856734,0.23606874,0.74507457,1,MyPlate Calorie Tracker,2021-04-22,,Does what it is supposed to do! Easy way to keep track!,Cindy L,4,3.5.3(54),neutral
1595,0.408699811,0.446696669,0.144603491,0,MyPlate Calorie Tracker,2021-04-22,,"I like the interface but if you want to add food via the barcode, be aware that 80% of the time, though the right product will come up, most of the values are wrong. From serving size, calories and macros. I expect to manually enter some things but not things that are supposedly in the database.",Nick Greiner,3,3.5.3(54),love
1596,0.001625445,0.026950248,0.971424282,1,MyPlate Calorie Tracker,2021-04-22,,This is a great App to download with your calories Tracker.,Debra Kelley,5,3.5.3(54),admiration
1597,0.007510221,0.025786454,0.966703355,1,MyPlate Calorie Tracker,2021-04-22,,"Pretty Good! I plan to change this review if any updates make it less fun or easy to use. But for a free app, it's great. I like being able to use something like this, its has respectful privacy policies, and does exactly what I need.",Radimash,5,3.5.3(54),admiration
1598,0.337819219,0.462057769,0.200122997,0,MyPlate Calorie Tracker,2021-04-22,,Sucky that there is pay walls to these to have full features. But for food tracking it's nice,Paco A,4,3.5.3(54),approval
1599,0.002254521,0.022530202,0.975215316,1,MyPlate Calorie Tracker,2021-04-21,,It's pretty good.,Robert Waltman,5,3.5.3(54),admiration
1600,0.023603726,0.301290244,0.675105989,1,MyPlate Calorie Tracker,2021-04-21,,It has the same features I want free of charge,G P,5,3.5.3(54),approval
1601,0.02011914,0.323247254,0.656633615,1,MyPlate Calorie Tracker,2021-04-20,,It works,Vasileios Kontorinis,5,3.5.3(54),neutral
1602,0.001581524,0.025070544,0.973347902,1,MyPlate Calorie Tracker,2021-04-20,,Awesome app for fitness enthusiast.,santhosh pawar,5,3.5.3(54),admiration
1603,0.004097225,0.0745764,0.921326399,1,MyPlate Calorie Tracker,2021-04-20,,easy to add foods and track everything . great to have to keep on track . lost 10 pounds just watching my foods,Electric Odyssey,5,3.5.3(54),admiration
1604,0.001989475,0.018355237,0.979655266,1,MyPlate Calorie Tracker,2021-04-19,,Easily the best macros app!,Xavier Thomas,5,,admiration
1605,0.044994071,0.231537744,0.723468184,1,MyPlate Calorie Tracker,2021-04-19,,"It's a really great app but I would appreciate some options added to the community for gaining weight as well, not just losing it. Then it will be perfect and fit for everybody. Gaining weight isn't the only struggle people have. I am underweight and want more options and tips since it is harder to find them than it is for weight loss. If more weight gain people grouped together, we could give tips like everyone else does. It's really hard to reach my goals without this feature",Sugar Fire,2,3.5.3(54),admiration
1606,0.466204345,0.351416022,0.182379588,0,MyPlate Calorie Tracker,2021-04-19,,Pretty good app but why does Google fit keep turning back on when I turn it off?,Bryan Edgehill,4,3.5.3(54),admiration
1607,0.001982888,0.040111352,0.957905769,1,MyPlate Calorie Tracker,2021-04-19,,Very easy to use. Scanner makes adding food items much easier.,jennifer rodriguez,5,3.5.3(54),neutral
1608,0.003135687,0.128777251,0.868087053,1,MyPlate Calorie Tracker,2021-04-19,,Great for tracking cals and macros!,Matt Janz,5,3.5.3(54),admiration
1609,0.00208729,0.017539471,0.980373263,1,MyPlate Calorie Tracker,2021-04-19,,Enjoying the basic so far!,Abigail Aldeguer,5,3.5.3(54),joy
1610,0.754994929,0.211370498,0.033634651,0,MyPlate Calorie Tracker,2021-04-18,,I can't even get in to app with my Google,Gail Wampler,5,3.5.3(54),approval
1611,0.001997815,0.02326702,0.9747352,1,MyPlate Calorie Tracker,2021-04-18,,Love it! Would have earned 5 stars if it connected to my Samsung fit tracker in my phone.,Teri H,4,3.5.3(54),love
1612,0.013841627,0.170462459,0.815695941,1,MyPlate Calorie Tracker,2021-04-18,,Easy peasy!,Erika Smith,5,3.5.3(54),neutral
1613,0.005309549,0.020249421,0.974440992,1,MyPlate Calorie Tracker,2021-04-17,,"I love it, took me a minute to figure it out but when I got it i was on a roll.",Chris McKeehan,5,3.5.3(54),love
1614,0.342343718,0.631385207,0.026271038,0,MyPlate Calorie Tracker,2021-04-17,,It didnt say there was a cost to use it.,Mark Schulz,1,,neutral
1615,0.008127591,0.054526769,0.937345624,1,MyPlate Calorie Tracker,2021-04-17,,"Great, easy to use",Dina-Marie Morgan,5,3.5.3(54),admiration
1616,0.889562845,0.100407161,0.010029997,0,MyPlate Calorie Tracker,2021-04-16,,"Lacking a lot of features, lacking a lot of items in search. I can't manually add nutritional information which means it's not calculating my home made meals properly. I have to try and find what's closest :(",Meg,2,3.5.3(54),disappointment
1617,0.002885849,0.007175297,0.989938855,1,MyPlate Calorie Tracker,2021-04-16,,I love this app,Shante Elliott,5,,love
1618,0.004134162,0.047140192,0.948725581,1,MyPlate Calorie Tracker,2021-04-15,,This is what I need!,Mia Fernandez,5,3.5.3(54),approval
1619,0.033833228,0.267107487,0.699059308,1,MyPlate Calorie Tracker,2021-04-14,,Great,Candy Snell,4,3.5.3(54),admiration
1620,0.060793415,0.329427898,0.609778702,1,MyPlate Calorie Tracker,2021-04-14,,Good,JWD,5,3.5.3(54),admiration
1621,0.007071971,0.113104045,0.879823983,1,MyPlate Calorie Tracker,2021-04-14,,Useful and easy to use.,mlctidwell,5,3.5.3(54),approval
1622,0.879889727,0.111976966,0.008133389,0,MyPlate Calorie Tracker,2021-04-13,,Would not allow me to reset password and nobody emailed me back to help fix my problem...,Lizzy Love,1,,neutral
1623,0.009869168,0.450349718,0.539781094,1,MyPlate Calorie Tracker,2021-04-13,,Most flexible format. Using keto program so very fat and protein emphasis.,Jackie Methe,5,3.5.3(54),neutral
1624,0.003897066,0.060463425,0.935639501,1,MyPlate Calorie Tracker,2021-04-12,,👍This is grate. Now I can reach my calorie goals. Thanks.,Chevan Joyles,5,3.5.3(54),gratitude
1625,0.010686486,0.06448359,0.92482996,1,MyPlate Calorie Tracker,2021-04-12,,AMAZING !!!,Osama Ebrahim,5,3.5.3(54),admiration
1626,0.014934164,0.184054554,0.801011264,1,MyPlate Calorie Tracker,2021-04-12,,Easy to use,Jenna Undestad,5,3.5.3(54),neutral
1627,0.424874216,0.507280827,0.067844972,0,MyPlate Calorie Tracker,2021-04-12,,I have installed the app on my new phone and when I tried to log in with my google account it said that I already have an account linked to the email address and I should log in with a different method. So I installed a different calorie counter.,Ryno van Zijl,1,3.5.3(54),approval
1628,0.014934164,0.184054554,0.801011264,1,MyPlate Calorie Tracker,2021-04-12,,Easy to use,Karen Fabros,5,3.5.3(54),neutral
1629,0.64428848,0.283640563,0.072070889,0,MyPlate Calorie Tracker,2021-04-11,,The help I needed. I didn't realize how many calories I was consuming. I was WAY OFF! I wanted to get healthy the right way. I picked the extreme option on my calorie reduction but it honestly doesn't feel extream. One month in and I've lost 11lbs! I have not been able to use the community tab though. It crashes the app everytime.,Lynna,4,3.5.3(54),realization
1630,0.55839783,0.413212121,0.028390048,0,MyPlate Calorie Tracker,2021-04-10,,seriously have to be a certain age just to do this ._.,Just A Non-Binary With A Mustache,1,3.5.3(54),neutral
1631,0.084991008,0.83242631,0.082582638,0,MyPlate Calorie Tracker,2021-04-10,,I will change my rating once I see a difference,Hope Taylor,1,3.5.3(54),approval
1632,0.008517599,0.388936251,0.602546155,1,MyPlate Calorie Tracker,2021-04-10,,Helps keep track 100%,Bobby Green,5,3.5.3(54),neutral
1633,0.003317941,0.054961715,0.941720426,1,MyPlate Calorie Tracker,2021-04-10,,"Although I've switched to another app, this did help me lose about 14lbs. Thanks! Edit: Ended up coming back to this app 👌",Decoda Hoover,5,,gratitude
1634,0.003380338,0.02166735,0.97495234,1,MyPlate Calorie Tracker,2021-04-10,,"Awesome app, extremely accurate",Mark Raibley,5,3.5.3(54),admiration
1635,0.001867188,0.035758201,0.962374687,1,MyPlate Calorie Tracker,2021-04-10,,So easy to use and very helpful to keep track of my habits.,Andrew Pedersen,5,3.5.3(54),approval
